State,District,Market,Commodity,Variety,Grade,Arrival_Date,Min_Price,Max_Price,Modal_Price,Commodity_Code,Year,Month,Day,DayName,Quarter,Price_Range,
Gujarat,Surat,Bardoli,Bhindi,Other,FAQ,01-07-2024,3000,3750,3500,85,2024,7,1,Monday,3,750,
Gujarat,Surat,Bardoli,Bhindi,Other,FAQ,09-07-2024,3000,3500,3250,85,2024,7,9,Tuesday,3,500,
Gujarat,Surat,Bardoli,Bhindi,Other,FAQ,10-07-2024,3000,3800,3500,85,2024,7,10,Wednesday,3,800,
Gujarat,Surat,Bardoli,Bhindi,Other,FAQ,12-07-2024,1850,3500,2500,85,2024,7,12,Friday,3,1650,
Gujarat,Surat,Bardoli,Bhindi,Other,FAQ,13-07-2024,1850,2850,2500,85,2024,7,13,Saturday,3,1000,
Gujarat,Surat,Bardoli,Bhindi,Other,FAQ,15-07-2024,2500,3500,3000,85,2024,7,15,Monday,3,1000,
Gujarat,Surat,Bardoli,Bhindi,Other,FAQ,18-07-2024,3250,3700,3500,85,2024,7,18,Thursday,3,450,
Gujarat,Surat,Bardoli,Bhindi,Other,FAQ,23-07-2024,3500,4000,3750,85,2024,7,23,Tuesday,3,500,
Gujarat,Surat,Bardoli,Brinjal,Other,FAQ,09-08-2024,3000,4000,3500,35,2024,8,9,Friday,3,1000,
Gujarat,Surat,Bardoli,Brinjal,Other,FAQ,29-08-2024,3500,4200,4000,35,2024,8,29,Thursday,3,700,
Gujarat,Surat,Bardoli,Brinjal,Other,FAQ,06-07-2024,3200,3700,3500,35,2024,7,6,Saturday,3,500,
Gujarat,Surat,Bardoli,Brinjal,Other,FAQ,08-07-2024,3000,3500,3250,35,2024,7,8,Monday,3,500,
Gujarat,Surat,Bardoli,Brinjal,Other,FAQ,17-07-2024,1850,3250,2500,35,2024,7,17,Wednesday,3,1400,
Gujarat,Surat,Bardoli,Brinjal,Other,FAQ,26-07-2024,3000,3750,3500,35,2024,7,26,Friday,3,750,
Gujarat,Surat,Bardoli,Bhindi,Other,FAQ,02-08-2024,3500,4200,4000,85,2024,8,2,Friday,3,700,
Gujarat,Surat,Bardoli,Bhindi,Other,FAQ,22-08-2024,4000,4800,4500,85,2024,8,22,Thursday,3,800,
Gujarat,Surat,Bardoli,Bhindi,Other,FAQ,23-08-2024,2550,3250,2850,85,2024,8,23,Friday,3,700,
Gujarat,Surat,Bardoli,Bhindi,Other,FAQ,09-05-2024,4000,4500,4250,85,2024,5,9,Thursday,2,500,
Gujarat,Surat,Bardoli,Bhindi,Other,FAQ,14-05-2024,4000,4500,4250,85,2024,5,14,Tuesday,2,500,
Gujarat,Surat,Bardoli,Bhindi,Other,FAQ,18-05-2024,3500,4200,4000,85,2024,5,18,Saturday,2,700,
Gujarat,Surat,Bardoli,Bhindi,Other,FAQ,25-05-2024,4000,4500,4200,85,2024,5,25,Saturday,2,500,
Gujarat,Surat,Bardoli,Brinjal,Other,FAQ,04-06-2024,1850,2250,2100,35,2024,6,4,Tuesday,2,400,
Gujarat,Surat,Bardoli,Brinjal,Other,FAQ,07-06-2024,2000,3000,2250,35,2024,6,7,Friday,2,1000,
Gujarat,Surat,Bardoli,Brinjal,Other,FAQ,10-06-2024,1500,2250,1850,35,2024,6,10,Monday,2,750,
Gujarat,Surat,Bardoli,Brinjal,Other,FAQ,11-06-2024,2500,3500,3000,35,2024,6,11,Tuesday,2,1000,
Gujarat,Surat,Bardoli,Brinjal,Other,FAQ,18-06-2024,3200,3400,3250,35,2024,6,18,Tuesday,2,200,
Gujarat,Surat,Bardoli,Brinjal,Other,FAQ,06-05-2024,2000,2500,2250,35,2024,5,6,Monday,2,500,
Gujarat,Surat,Bardoli,Brinjal,Other,FAQ,11-05-2024,2000,2500,2250,35,2024,5,11,Saturday,2,500,
Gujarat,Surat,Bardoli,Brinjal,Other,FAQ,15-05-2024,2000,2400,2250,35,2024,5,15,Wednesday,2,400,
Gujarat,Surat,Bardoli,Bhindi,Other,FAQ,01-03-2024,2000,3000,2500,85,2024,3,1,Friday,1,1000,
Gujarat,Surat,Bardoli,Bhindi,Other,FAQ,22-03-2024,1250,2150,1550,85,2024,3,22,Friday,1,900,
Gujarat,Surat,Bardoli,Bhindi,Other,FAQ,30-03-2024,3500,4500,4000,85,2024,3,30,Saturday,1,1000,
Gujarat,Surat,Bardoli,Bhindi,Other,FAQ,04-04-2024,3500,4500,4000,85,2024,4,4,Thursday,2,1000,
Gujarat,Surat,Bardoli,Bhindi,Other,FAQ,19-01-2024,2500,3000,2800,85,2024,1,19,Friday,1,500,
Gujarat,Surat,Bardoli,Bhindi,Other,FAQ,16-04-2024,1500,2250,1850,85,2024,4,16,Tuesday,2,750,
Gujarat,Surat,Bardoli,Bhindi,Other,FAQ,24-01-2024,2000,3000,2500,85,2024,1,24,Wednesday,1,1000,
Gujarat,Surat,Bardoli,Bhindi,Other,FAQ,16-02-2024,2000,2400,2250,85,2024,2,16,Friday,1,400,
Gujarat,Surat,Bardoli,Bhindi,Other,FAQ,06-03-2024,3500,4000,3750,85,2024,3,6,Wednesday,1,500,
Gujarat,Surat,Bardoli,Bhindi,Other,FAQ,23-03-2024,3500,4500,4000,85,2024,3,23,Saturday,1,1000,
Gujarat,Surat,Bardoli,Brinjal,Other,FAQ,10-01-2024,3500,4000,3750,35,2024,1,10,Wednesday,1,500,
Gujarat,Surat,Bardoli,Brinjal,Other,FAQ,11-01-2024,1800,2750,2500,35,2024,1,11,Thursday,1,950,
Gujarat,Surat,Bardoli,Brinjal,Other,FAQ,23-01-2024,2500,3000,2750,35,2024,1,23,Tuesday,1,500,
Gujarat,Surat,Bardoli,Brinjal,Other,FAQ,10-02-2024,2000,2500,2250,35,2024,2,10,Saturday,1,500,
Gujarat,Surat,Bardoli,Brinjal,Other,FAQ,13-02-2024,1800,2200,2000,35,2024,2,13,Tuesday,1,400,
Gujarat,Surat,Bardoli,Brinjal,Other,FAQ,16-02-2024,1800,2200,2000,35,2024,2,16,Friday,1,400,
Gujarat,Surat,Bardoli,Brinjal,Other,FAQ,20-02-2024,2000,2400,2250,35,2024,2,20,Tuesday,1,400,
Gujarat,Surat,Bardoli,Brinjal,Other,FAQ,04-03-2024,2000,3000,2500,35,2024,3,4,Monday,1,1000,
Gujarat,Surat,Bardoli,Brinjal,Other,FAQ,15-03-2024,1850,2550,2050,35,2024,3,15,Friday,1,700,
Gujarat,Surat,Bardoli,Brinjal,Other,FAQ,03-04-2024,850,1550,1250,35,2024,4,3,Wednesday,2,700,
Gujarat,Surat,Bardoli,Brinjal,Other,FAQ,10-04-2024,1800,2250,2000,35,2024,4,10,Wednesday,2,450,
Gujarat,Surat,Bardoli,Brinjal,Other,FAQ,19-04-2024,2000,3000,2250,35,2024,4,19,Friday,2,1000,
Gujarat,Surat,Bardoli,Brinjal,Other,FAQ,12-09-2024,2850,3250,2900,35,2024,9,12,Thursday,3,400,
Gujarat,Surat,Bardoli,Brinjal,Other,FAQ,18-09-2024,2500,3250,2750,35,2024,9,18,Wednesday,3,750,
Gujarat,Surat,Bardoli,Brinjal,Other,FAQ,21-09-2024,3500,4500,4000,35,2024,9,21,Saturday,3,1000,
Gujarat,Surat,Bardoli,Brinjal,Other,FAQ,06-09-2024,2500,3500,2850,35,2024,9,6,Friday,3,1000,
Gujarat,Surat,Bardoli,Brinjal,Other,FAQ,13-09-2024,4000,4800,4500,35,2024,9,13,Friday,3,800,
Gujarat,Surat,Bardoli,Brinjal,Other,FAQ,14-09-2024,3500,4500,4000,35,2024,9,14,Saturday,3,1000,
Gujarat,Surat,Bardoli,Brinjal,Other,FAQ,25-09-2024,2500,3250,2800,35,2024,9,25,Wednesday,3,750,
Gujarat,Surat,Bardoli,Bhindi,Other,FAQ,06-09-2024,2500,3250,2750,85,2024,9,6,Friday,3,750,
Gujarat,Surat,Bardoli,Bhindi,Other,FAQ,14-09-2024,3000,3750,3500,85,2024,9,14,Saturday,3,750,
Gujarat,Surat,Bardoli,Bhindi,Other,FAQ,19-09-2024,2500,3050,2850,85,2024,9,19,Thursday,3,550,
Gujarat,Surat,Bardoli,Bhindi,Other,FAQ,28-09-2024,2200,3050,2500,85,2024,9,28,Saturday,3,850,
Gujarat,Surat,Bardoli,Bhindi,Other,FAQ,04-06-2024,1250,1950,1750,85,2024,6,4,Tuesday,2,700,
Gujarat,Surat,Bardoli,Bhindi,Other,FAQ,27-06-2024,3000,3500,3250,85,2024,6,27,Thursday,2,500,
Gujarat,Surat,Bardoli,Bhindi,Other,FAQ,18-06-2024,3500,4000,3750,85,2024,6,18,Tuesday,2,500,
Gujarat,Surat,Bardoli,Bhindi,Other,FAQ,29-06-2024,3000,3500,3250,85,2024,6,29,Saturday,2,500,
Gujarat,Surat,Bardoli,Bhindi,Other,FAQ,07-11-2024,1850,2550,2150,85,2024,11,7,Thursday,4,700,
Gujarat,Surat,Bardoli,Bhindi,Other,FAQ,09-11-2024,1500,3250,2550,85,2024,11,9,Saturday,4,1750,
Gujarat,Surat,Bardoli,Bhindi,Other,FAQ,19-11-2024,1850,2500,2150,85,2024,11,19,Tuesday,4,650,
Gujarat,Surat,Bardoli,Bhindi,Other,FAQ,23-11-2024,1850,2550,2150,85,2024,11,23,Saturday,4,700,
Gujarat,Surat,Bardoli,Brinjal,Other,FAQ,13-12-2024,1850,2550,2150,35,2024,12,13,Friday,4,700,
Gujarat,Surat,Bardoli,Brinjal,Other,FAQ,14-12-2024,1850,2550,2250,35,2024,12,14,Saturday,4,700,
Gujarat,Surat,Bardoli,Brinjal,Other,FAQ,17-12-2024,1850,2250,2150,35,2024,12,17,Tuesday,4,400,
Gujarat,Surat,Bardoli,Bhindi,Other,FAQ,09-12-2024,1850,2550,2150,85,2024,12,9,Monday,4,700,
Gujarat,Surat,Bardoli,Bhindi,Other,FAQ,10-12-2024,1500,2550,1850,85,2024,12,10,Tuesday,4,1050,
Gujarat,Surat,Bardoli,Bhindi,Other,FAQ,18-12-2024,1500,2550,1850,85,2024,12,18,Wednesday,4,1050,
Gujarat,Surat,Bardoli,Bhindi,Other,FAQ,27-12-2024,1250,2250,1850,85,2024,12,27,Friday,4,1000,
Gujarat,Surat,Bardoli,Brinjal,Other,FAQ,19-11-2024,1850,2850,2150,35,2024,11,19,Tuesday,4,1000,
Gujarat,Surat,Bardoli,Bhindi,Other,FAQ,05-10-2024,2500,3500,3000,85,2024,10,5,Saturday,4,1000,
Gujarat,Surat,Bardoli,Bhindi,Other,FAQ,10-10-2024,1550,2500,1850,85,2024,10,10,Thursday,4,950,
Gujarat,Surat,Bardoli,Bhindi,Other,FAQ,28-10-2024,1550,3250,2500,85,2024,10,28,Monday,4,1700,
Gujarat,Surat,Bardoli,Bhindi,Other,FAQ,07-10-2024,1500,2500,1850,85,2024,10,7,Monday,4,1000,
Gujarat,Surat,Bardoli,Bhindi,Other,FAQ,26-10-2024,1550,2550,1850,85,2024,10,26,Saturday,4,1000,
Gujarat,Surat,Bardoli,Brinjal,Other,FAQ,14-10-2024,1550,2650,1950,35,2024,10,14,Monday,4,1100,
Gujarat,Surat,Bardoli,Brinjal,Other,FAQ,25-10-2024,1500,2850,2100,35,2024,10,25,Friday,4,1350,
Gujarat,Surat,Bardoli,Brinjal,Other,FAQ,08-10-2024,1550,3050,1850,35,2024,10,8,Tuesday,4,1500,
Gujarat,Surat,Bardoli,Brinjal,Other,FAQ,24-10-2024,3000,4000,3500,35,2024,10,24,Thursday,4,1000,
Gujarat,Surat,Bardoli,Bhindi,Other,FAQ,14-11-2024,1850,2550,2150,85,2024,11,14,Thursday,4,700,
Gujarat,Surat,Bardoli,Bhindi,Other,FAQ,22-11-2024,1550,2350,1950,85,2024,11,22,Friday,4,800,
Gujarat,Surat,Bardoli,Bhindi,Other,FAQ,29-11-2024,1550,2500,1850,85,2024,11,29,Friday,4,950,
Gujarat,Surat,Bardoli,Brinjal,Other,FAQ,11-09-2024,2400,2850,2600,35,2024,9,11,Wednesday,3,450,
Gujarat,Surat,Bardoli,Brinjal,Other,FAQ,19-09-2024,2500,3300,3200,35,2024,9,19,Thursday,3,800,
Gujarat,Surat,Bardoli,Brinjal,Other,FAQ,24-09-2024,4000,4500,4250,35,2024,9,24,Tuesday,3,500,
Gujarat,Surat,Bardoli,Brinjal,Other,FAQ,27-09-2024,3000,4000,3500,35,2024,9,27,Friday,3,1000,
Gujarat,Surat,Bardoli,Bhindi,Other,FAQ,05-09-2024,2500,3500,3000,85,2024,9,5,Thursday,3,1000,
Gujarat,Surat,Bardoli,Bhindi,Other,FAQ,10-09-2024,3000,3750,3500,85,2024,9,10,Tuesday,3,750,
Gujarat,Surat,Bardoli,Bhindi,Other,FAQ,25-09-2024,2500,3250,2850,85,2024,9,25,Wednesday,3,750,
Gujarat,Surat,Bardoli,Bhindi,Other,FAQ,04-10-2024,1500,3000,2500,85,2024,10,4,Friday,4,1500,
Gujarat,Surat,Bardoli,Brinjal,Other,FAQ,17-08-2024,3500,4000,3750,35,2024,8,17,Saturday,3,500,
Gujarat,Surat,Bardoli,Bhindi,Other,FAQ,05-08-2024,3000,3500,3250,85,2024,8,5,Monday,3,500,
Gujarat,Surat,Bardoli,Bhindi,Other,FAQ,08-08-2024,2500,3500,2850,85,2024,8,8,Thursday,3,1000,
Gujarat,Surat,Bardoli,Bhindi,Other,FAQ,09-08-2024,3500,4000,3750,85,2024,8,9,Friday,3,500,
Gujarat,Surat,Bardoli,Bhindi,Other,FAQ,24-08-2024,3000,3750,3500,85,2024,8,24,Saturday,3,750,
Gujarat,Surat,Bardoli,Bhindi,Other,FAQ,13-12-2024,1580,2100,1850,85,2024,12,13,Friday,4,520,
Gujarat,Surat,Bardoli,Bhindi,Other,FAQ,14-12-2024,1500,2100,1850,85,2024,12,14,Saturday,4,600,
Gujarat,Surat,Bardoli,Bhindi,Other,FAQ,17-12-2024,1550,2550,1850,85,2024,12,17,Tuesday,4,1000,
Gujarat,Surat,Bardoli,Bhindi,Other,FAQ,20-12-2024,1250,1850,1550,85,2024,12,20,Friday,4,600,
Gujarat,Surat,Bardoli,Bhindi,Other,FAQ,23-12-2024,1500,2500,1850,85,2024,12,23,Monday,4,1000,
Gujarat,Surat,Bardoli,Bhindi,Other,FAQ,28-12-2024,1250,2150,1850,85,2024,12,28,Saturday,4,900,
Gujarat,Surat,Bardoli,Brinjal,Other,FAQ,05-10-2024,3500,4000,3750,35,2024,10,5,Saturday,4,500,
Gujarat,Surat,Bardoli,Brinjal,Other,FAQ,04-10-2024,2100,3000,2500,35,2024,10,4,Friday,4,900,
Gujarat,Surat,Bardoli,Brinjal,Other,FAQ,10-12-2024,1850,2750,2150,35,2024,12,10,Tuesday,4,900,
Gujarat,Surat,Bardoli,Brinjal,Other,FAQ,18-12-2024,1500,2850,2150,35,2024,12,18,Wednesday,4,1350,
Gujarat,Surat,Bardoli,Brinjal,Other,FAQ,21-12-2024,1250,2500,1850,35,2024,12,21,Saturday,4,1250,
Gujarat,Surat,Bardoli,Brinjal,Other,FAQ,27-12-2024,1250,2450,1850,35,2024,12,27,Friday,4,1200,
Gujarat,Surat,Bardoli,Bhindi,Other,FAQ,11-10-2024,1550,2500,1850,85,2024,10,11,Friday,4,950,
Gujarat,Surat,Bardoli,Brinjal,Other,FAQ,13-11-2024,1850,2550,2250,35,2024,11,13,Wednesday,4,700,
Gujarat,Surat,Bardoli,Brinjal,Other,FAQ,20-11-2024,2150,2850,2550,35,2024,11,20,Wednesday,4,700,
Gujarat,Surat,Bardoli,Brinjal,Other,FAQ,22-11-2024,1850,2850,2150,35,2024,11,22,Friday,4,1000,
Gujarat,Surat,Bardoli,Brinjal,Other,FAQ,07-11-2024,2150,2550,2250,35,2024,11,7,Thursday,4,400,
Gujarat,Surat,Bardoli,Brinjal,Other,FAQ,11-11-2024,1850,3000,2500,35,2024,11,11,Monday,4,1150,
Gujarat,Surat,Bardoli,Brinjal,Other,FAQ,21-11-2024,1850,2750,2150,35,2024,11,21,Thursday,4,900,
Gujarat,Surat,Bardoli,Brinjal,Other,FAQ,25-11-2024,1550,2850,1850,35,2024,11,25,Monday,4,1300,
Gujarat,Surat,Bardoli,Brinjal,Other,FAQ,29-11-2024,1850,2550,2150,35,2024,11,29,Friday,4,700,
Gujarat,Surat,Bardoli,Brinjal,Other,FAQ,04-09-2024,2500,3500,3250,35,2024,9,4,Wednesday,3,1000,
Gujarat,Surat,Bardoli,Brinjal,Other,FAQ,23-09-2024,4000,4700,4500,35,2024,9,23,Monday,3,700,
Gujarat,Surat,Bardoli,Brinjal,Other,FAQ,26-09-2024,2500,3200,3000,35,2024,9,26,Thursday,3,700,
Gujarat,Surat,Bardoli,Bhindi,Other,FAQ,18-01-2024,2000,3000,2500,85,2024,1,18,Thursday,1,1000,
Gujarat,Surat,Bardoli,Bhindi,Other,FAQ,09-02-2024,1800,2200,2000,85,2024,2,9,Friday,1,400,
Gujarat,Surat,Bardoli,Bhindi,Other,FAQ,10-02-2024,1800,2500,2000,85,2024,2,10,Saturday,1,700,
Gujarat,Surat,Bardoli,Bhindi,Other,FAQ,04-03-2024,3000,4000,3250,85,2024,3,4,Monday,1,1000,
Gujarat,Surat,Bardoli,Bhindi,Other,FAQ,15-03-2024,1500,2250,2000,85,2024,3,15,Friday,1,750,
Gujarat,Surat,Bardoli,Bhindi,Other,FAQ,19-03-2024,1500,2000,1850,85,2024,3,19,Tuesday,1,500,
Gujarat,Surat,Bardoli,Bhindi,Other,FAQ,19-04-2024,3500,4500,4000,85,2024,4,19,Friday,2,1000,
Gujarat,Surat,Bardoli,Bhindi,Other,FAQ,01-05-2024,4000,4500,4200,85,2024,5,1,Wednesday,2,500,
Gujarat,Surat,Bardoli,Bhindi,Other,FAQ,16-05-2024,4000,4500,4250,85,2024,5,16,Thursday,2,500,
Gujarat,Surat,Bardoli,Bhindi,Other,FAQ,28-05-2024,1050,1850,1250,85,2024,5,28,Tuesday,2,800,
Gujarat,Surat,Bardoli,Bhindi,Other,FAQ,07-06-2024,3000,4200,3500,85,2024,6,7,Friday,2,1200,
Gujarat,Surat,Bardoli,Bhindi,Other,FAQ,13-06-2024,3000,4000,3500,85,2024,6,13,Thursday,2,1000,
Gujarat,Surat,Bardoli,Bhindi,Other,FAQ,20-06-2024,3500,3800,3750,85,2024,6,20,Thursday,2,300,
Gujarat,Surat,Bardoli,Brinjal,Other,FAQ,08-05-2024,1800,2500,2000,35,2024,5,8,Wednesday,2,700,
Gujarat,Surat,Bardoli,Brinjal,Other,FAQ,14-05-2024,2000,2500,2250,35,2024,5,14,Tuesday,2,500,
Gujarat,Surat,Bardoli,Brinjal,Other,FAQ,18-05-2024,1800,2250,2000,35,2024,5,18,Saturday,2,450,
Gujarat,Surat,Bardoli,Brinjal,Other,FAQ,20-05-2024,2000,2150,2150,35,2024,5,20,Monday,2,150,
Gujarat,Surat,Bardoli,Brinjal,Other,FAQ,25-05-2024,2000,2400,2250,35,2024,5,25,Saturday,2,400,
Gujarat,Surat,Bardoli,Brinjal,Other,FAQ,27-05-2024,1250,2200,1850,35,2024,5,27,Monday,2,950,
Gujarat,Surat,Bardoli,Brinjal,Other,FAQ,31-05-2024,3000,3500,3250,35,2024,5,31,Friday,2,500,
Gujarat,Surat,Bardoli,Brinjal,Other,FAQ,15-01-2024,1500,2210,1950,35,2024,1,15,Monday,1,710,
Gujarat,Surat,Bardoli,Brinjal,Other,FAQ,19-01-2024,3000,3500,3250,35,2024,1,19,Friday,1,500,
Gujarat,Surat,Bardoli,Brinjal,Other,FAQ,24-01-2024,2500,3250,3000,35,2024,1,24,Wednesday,1,750,
Gujarat,Surat,Bardoli,Brinjal,Other,FAQ,09-02-2024,2000,2500,2250,35,2024,2,9,Friday,1,500,
Gujarat,Surat,Bardoli,Brinjal,Other,FAQ,14-02-2024,1650,2250,2100,35,2024,2,14,Wednesday,1,600,
Gujarat,Surat,Bardoli,Brinjal,Other,FAQ,06-03-2024,2000,2500,2250,35,2024,3,6,Wednesday,1,500,
Gujarat,Surat,Bardoli,Brinjal,Other,FAQ,14-03-2024,1800,2200,2000,35,2024,3,14,Thursday,1,400,
Gujarat,Surat,Bardoli,Brinjal,Other,FAQ,26-03-2024,1550,2150,1850,35,2024,3,26,Tuesday,1,600,
Gujarat,Surat,Bardoli,Brinjal,Other,FAQ,05-04-2024,1800,2500,2000,35,2024,4,5,Friday,2,700,
Gujarat,Surat,Bardoli,Brinjal,Other,FAQ,13-04-2024,2000,2500,2250,35,2024,4,13,Saturday,2,500,
Gujarat,Surat,Bardoli,Brinjal,Other,FAQ,23-04-2024,1500,2250,1800,35,2024,4,23,Tuesday,2,750,
Gujarat,Surat,Bardoli,Brinjal,Other,FAQ,24-04-2024,1050,1850,1550,35,2024,4,24,Wednesday,2,800,
Gujarat,Surat,Bardoli,Bhindi,Other,FAQ,01-04-2024,3000,4000,3500,85,2024,4,1,Monday,2,1000,
Gujarat,Surat,Bardoli,Bhindi,Other,FAQ,05-04-2024,3500,4500,4000,85,2024,4,5,Friday,2,1000,
Gujarat,Surat,Bardoli,Bhindi,Other,FAQ,09-04-2024,4000,4500,4250,85,2024,4,9,Tuesday,2,500,
Gujarat,Surat,Bardoli,Bhindi,Other,FAQ,22-04-2024,4000,4800,4500,85,2024,4,22,Monday,2,800,
Gujarat,Surat,Bardoli,Bhindi,Other,FAQ,11-01-2024,2500,3500,2700,85,2024,1,11,Thursday,1,1000,
Gujarat,Surat,Bardoli,Bhindi,Other,FAQ,28-02-2024,1500,2250,2000,85,2024,2,28,Wednesday,1,750,
Gujarat,Surat,Bardoli,Bhindi,Other,FAQ,05-03-2024,3000,4000,3500,85,2024,3,5,Tuesday,1,1000,
Gujarat,Surat,Bardoli,Bhindi,Other,FAQ,21-03-2024,1250,2150,1850,85,2024,3,21,Thursday,1,900,
Gujarat,Surat,Bardoli,Bhindi,Other,FAQ,26-04-2024,1250,1850,1550,85,2024,4,26,Friday,2,600,
Gujarat,Surat,Bardoli,Brinjal,Other,FAQ,20-06-2024,3000,3500,3200,35,2024,6,20,Thursday,2,500,
Gujarat,Surat,Bardoli,Brinjal,Other,FAQ,25-06-2024,1500,2500,2100,35,2024,6,25,Tuesday,2,1000,
Gujarat,Surat,Bardoli,Brinjal,Other,FAQ,27-06-2024,3250,4000,3500,35,2024,6,27,Thursday,2,750,
Gujarat,Surat,Bardoli,Bhindi,Other,FAQ,02-07-2024,3000,3300,3250,85,2024,7,2,Tuesday,3,300,
Gujarat,Surat,Bardoli,Bhindi,Other,FAQ,11-07-2024,3000,3500,3250,85,2024,7,11,Thursday,3,500,
Gujarat,Surat,Bardoli,Bhindi,Other,FAQ,16-07-2024,3000,3750,3500,85,2024,7,16,Tuesday,3,750,
Gujarat,Surat,Bardoli,Bhindi,Other,FAQ,19-07-2024,3000,3500,3250,85,2024,7,19,Friday,3,500,
Gujarat,Surat,Bardoli,Bhindi,Other,FAQ,30-07-2024,1850,3000,2500,85,2024,7,30,Tuesday,3,1150,
Gujarat,Surat,Bardoli,Brinjal,Other,FAQ,03-07-2024,3200,3700,3500,35,2024,7,3,Wednesday,3,500,
Gujarat,Surat,Bardoli,Brinjal,Other,FAQ,04-07-2024,3000,3750,3500,35,2024,7,4,Thursday,3,750,
Gujarat,Surat,Bardoli,Brinjal,Other,FAQ,11-07-2024,3500,3800,3750,35,2024,7,11,Thursday,3,300,
Gujarat,Surat,Bardoli,Brinjal,Other,FAQ,13-07-2024,2500,3000,2850,35,2024,7,13,Saturday,3,500,
Gujarat,Surat,Bardoli,Brinjal,Other,FAQ,18-07-2024,3500,4100,3750,35,2024,7,18,Thursday,3,600,
Gujarat,Surat,Bardoli,Brinjal,Other,FAQ,23-07-2024,3500,4200,4000,35,2024,7,23,Tuesday,3,700,
Gujarat,Surat,Bardoli,Brinjal,Other,FAQ,24-07-2024,3400,3550,3500,35,2024,7,24,Wednesday,3,150,
Gujarat,Surat,Bardoli,Brinjal,Other,FAQ,27-07-2024,3000,4000,3750,35,2024,7,27,Saturday,3,1000,
Gujarat,Surat,Bardoli,Brinjal,Other,FAQ,23-10-2024,1550,2500,2150,35,2024,10,23,Wednesday,4,950,
Gujarat,Surat,Bardoli,Brinjal,Other,FAQ,10-10-2024,1850,2850,2150,35,2024,10,10,Thursday,4,1000,
Gujarat,Surat,Bardoli,Brinjal,Other,FAQ,15-10-2024,3500,4200,4000,35,2024,10,15,Tuesday,4,700,
Gujarat,Surat,Bardoli,Brinjal,Other,FAQ,16-10-2024,1850,2500,2150,35,2024,10,16,Wednesday,4,650,
Gujarat,Surat,Bardoli,Bhindi,Other,FAQ,16-10-2024,1550,2250,1850,85,2024,10,16,Wednesday,4,700,
Gujarat,Surat,Bardoli,Bhindi,Other,FAQ,08-10-2024,1555,2500,1850,85,2024,10,8,Tuesday,4,945,
Gujarat,Surat,Bardoli,Bhindi,Other,FAQ,21-10-2024,1550,2550,2150,85,2024,10,21,Monday,4,1000,
Gujarat,Surat,Bardoli,Brinjal,Other,FAQ,05-11-2024,1950,2750,2350,35,2024,11,5,Tuesday,4,800,
Gujarat,Surat,Bardoli,Bhindi,Other,FAQ,02-05-2024,1550,2150,1800,85,2024,5,2,Thursday,2,600,
Gujarat,Surat,Bardoli,Bhindi,Other,FAQ,15-05-2024,4000,4500,4250,85,2024,5,15,Wednesday,2,500,
Gujarat,Surat,Bardoli,Bhindi,Other,FAQ,23-05-2024,4000,4500,4200,85,2024,5,23,Thursday,2,500,
Gujarat,Surat,Bardoli,Bhindi,Other,FAQ,27-05-2024,1550,2150,1850,85,2024,5,27,Monday,2,600,
Gujarat,Surat,Bardoli,Bhindi,Other,FAQ,30-05-2024,3500,4000,3700,85,2024,5,30,Thursday,2,500,
Gujarat,Surat,Bardoli,Brinjal,Other,FAQ,08-01-2024,2000,2750,2500,35,2024,1,8,Monday,1,750,
Gujarat,Surat,Bardoli,Brinjal,Other,FAQ,12-01-2024,3000,3500,3250,35,2024,1,12,Friday,1,500,
Gujarat,Surat,Bardoli,Brinjal,Other,FAQ,18-01-2024,2500,3200,3000,35,2024,1,18,Thursday,1,700,
Gujarat,Surat,Bardoli,Brinjal,Other,FAQ,29-01-2024,2250,3000,2500,35,2024,1,29,Monday,1,750,
Gujarat,Surat,Bardoli,Brinjal,Other,FAQ,21-02-2024,2000,2500,2250,35,2024,2,21,Wednesday,1,500,
Gujarat,Surat,Bardoli,Brinjal,Other,FAQ,22-02-2024,2000,2500,2250,35,2024,2,22,Thursday,1,500,
Gujarat,Surat,Bardoli,Brinjal,Other,FAQ,02-03-2024,1850,2150,2000,35,2024,3,2,Saturday,1,300,
Gujarat,Surat,Bardoli,Brinjal,Other,FAQ,13-03-2024,1750,2200,2000,35,2024,3,13,Wednesday,1,450,
Gujarat,Surat,Bardoli,Brinjal,Other,FAQ,01-04-2024,1750,2500,2000,35,2024,4,1,Monday,2,750,
Gujarat,Surat,Bardoli,Brinjal,Other,FAQ,15-04-2024,2000,2500,2250,35,2024,4,15,Monday,2,500,
Gujarat,Surat,Bardoli,Brinjal,Other,FAQ,16-04-2024,850,1950,1250,35,2024,4,16,Tuesday,2,1100,
Gujarat,Surat,Bardoli,Brinjal,Other,FAQ,22-04-2024,2000,2500,2250,35,2024,4,22,Monday,2,500,
Gujarat,Surat,Bardoli,Brinjal,Other,FAQ,30-04-2024,1750,2200,2000,35,2024,4,30,Tuesday,2,450,
Gujarat,Surat,Bardoli,Bhindi,Other,FAQ,06-06-2024,1250,2250,1850,85,2024,6,6,Thursday,2,1000,
Gujarat,Surat,Bardoli,Bhindi,Other,FAQ,12-06-2024,3000,3700,3500,85,2024,6,12,Wednesday,2,700,
Gujarat,Surat,Bardoli,Bhindi,Other,FAQ,22-06-2024,3000,4000,3500,85,2024,6,22,Saturday,2,1000,
Gujarat,Surat,Bardoli,Bhindi,Other,FAQ,24-06-2024,3000,4000,3500,85,2024,6,24,Monday,2,1000,
Gujarat,Surat,Bardoli,Bhindi,Other,FAQ,26-06-2024,3000,3500,3250,85,2024,6,26,Wednesday,2,500,
Gujarat,Surat,Bardoli,Brinjal,Other,FAQ,15-06-2024,3500,4000,3750,35,2024,6,15,Saturday,2,500,
Gujarat,Surat,Bardoli,Brinjal,Other,FAQ,19-06-2024,3000,3250,3250,35,2024,6,19,Wednesday,2,250,
Gujarat,Surat,Bardoli,Brinjal,Other,FAQ,22-06-2024,2800,3200,3000,35,2024,6,22,Saturday,2,400,
Gujarat,Surat,Bardoli,Brinjal,Other,FAQ,02-07-2024,3200,3750,3500,35,2024,7,2,Tuesday,3,550,
Gujarat,Surat,Bardoli,Brinjal,Other,FAQ,10-07-2024,3500,4000,3750,35,2024,7,10,Wednesday,3,500,
Gujarat,Surat,Bardoli,Brinjal,Other,FAQ,12-07-2024,2150,3850,2500,35,2024,7,12,Friday,3,1700,
Gujarat,Surat,Bardoli,Brinjal,Other,FAQ,20-07-2024,2500,3200,2850,35,2024,7,20,Saturday,3,700,
Gujarat,Surat,Bardoli,Brinjal,Other,FAQ,30-07-2024,2500,3250,2750,35,2024,7,30,Tuesday,3,750,
Gujarat,Surat,Bardoli,Bhindi,Other,FAQ,27-07-2024,3500,4200,4000,85,2024,7,27,Saturday,3,700,
Gujarat,Surat,Bardoli,Bhindi,Other,FAQ,29-07-2024,3000,3800,3500,85,2024,7,29,Monday,3,800,
Gujarat,Surat,Bardoli,Bhindi,Other,FAQ,03-07-2024,3000,3500,3250,85,2024,7,3,Wednesday,3,500,
Gujarat,Surat,Bardoli,Bhindi,Other,FAQ,25-07-2024,3500,4000,3750,85,2024,7,25,Thursday,3,500,
Gujarat,Surat,Bardoli,Bhindi,Other,FAQ,07-12-2024,1850,2550,2150,85,2024,12,7,Saturday,4,700,
Gujarat,Surat,Bardoli,Brinjal,Other,FAQ,06-12-2024,2450,2800,2750,35,2024,12,6,Friday,4,350,
Gujarat,Surat,Bardoli,Brinjal,Other,FAQ,07-12-2024,2000,2750,2250,35,2024,12,7,Saturday,4,750,
Gujarat,Surat,Bardoli,Brinjal,Other,FAQ,26-12-2024,1550,2550,2100,35,2024,12,26,Thursday,4,1000,
Gujarat,Surat,Bardoli,Brinjal,Other,FAQ,28-12-2024,1250,2250,1950,35,2024,12,28,Saturday,4,1000,
Gujarat,Surat,Bardoli,Bhindi,Other,FAQ,06-12-2024,2500,3000,2750,85,2024,12,6,Friday,4,500,
Gujarat,Surat,Bardoli,Bhindi,Other,FAQ,05-11-2024,1850,3000,2500,85,2024,11,5,Tuesday,4,1150,
Gujarat,Surat,Bardoli,Bhindi,Other,FAQ,11-11-2024,1550,3250,2500,85,2024,11,11,Monday,4,1700,
Gujarat,Surat,Bardoli,Bhindi,Other,FAQ,20-11-2024,1850,2550,2150,85,2024,11,20,Wednesday,4,700,
Gujarat,Surat,Bardoli,Bhindi,Other,FAQ,27-11-2024,1550,2550,1850,85,2024,11,27,Wednesday,4,1000,
Gujarat,Surat,Bardoli,Bhindi,Other,FAQ,04-09-2024,2500,3250,2850,85,2024,9,4,Wednesday,3,750,
Gujarat,Surat,Bardoli,Bhindi,Other,FAQ,09-09-2024,2500,3250,3000,85,2024,9,9,Monday,3,750,
Gujarat,Surat,Bardoli,Bhindi,Other,FAQ,12-09-2024,2500,3250,2750,85,2024,9,12,Thursday,3,750,
Gujarat,Surat,Bardoli,Bhindi,Other,FAQ,20-09-2024,2000,3000,2250,85,2024,9,20,Friday,3,1000,
Gujarat,Surat,Bardoli,Bhindi,Other,FAQ,23-09-2024,3000,4000,3500,85,2024,9,23,Monday,3,1000,
Gujarat,Surat,Bardoli,Bhindi,Other,FAQ,24-09-2024,3000,3750,3500,85,2024,9,24,Tuesday,3,750,
Gujarat,Surat,Bardoli,Brinjal,Other,FAQ,05-09-2024,2500,3200,3000,35,2024,9,5,Thursday,3,700,
Gujarat,Surat,Bardoli,Brinjal,Other,FAQ,10-09-2024,2500,4000,3500,35,2024,9,10,Tuesday,3,1500,
Gujarat,Surat,Bardoli,Brinjal,Other,FAQ,28-09-2024,2100,2850,2500,35,2024,9,28,Saturday,3,750,
Gujarat,Surat,Bardoli,Brinjal,Other,FAQ,01-05-2024,1800,2500,2000,35,2024,5,1,Wednesday,2,700,
Gujarat,Surat,Bardoli,Bhindi,Other,FAQ,01-08-2024,3200,3800,3500,85,2024,8,1,Thursday,3,600,
Gujarat,Surat,Bardoli,Bhindi,Other,FAQ,03-08-2024,3000,3750,3500,85,2024,8,3,Saturday,3,750,
Gujarat,Surat,Bardoli,Bhindi,Other,FAQ,06-08-2024,3000,3500,3250,85,2024,8,6,Tuesday,3,500,
Gujarat,Surat,Bardoli,Bhindi,Other,FAQ,10-08-2024,2500,3500,3250,85,2024,8,10,Saturday,3,1000,
Gujarat,Surat,Bardoli,Bhindi,Other,FAQ,21-08-2024,3500,4200,4000,85,2024,8,21,Wednesday,3,700,
Gujarat,Surat,Bardoli,Bhindi,Other,FAQ,27-08-2024,2500,3500,3250,85,2024,8,27,Tuesday,3,1000,
Gujarat,Surat,Bardoli,Bhindi,Other,FAQ,31-08-2024,2000,2750,2250,85,2024,8,31,Saturday,3,750,
Gujarat,Surat,Bardoli,Brinjal,Other,FAQ,03-08-2024,3500,4200,4000,35,2024,8,3,Saturday,3,700,
Gujarat,Surat,Bardoli,Brinjal,Other,FAQ,06-08-2024,3000,3500,3250,35,2024,8,6,Tuesday,3,500,
Gujarat,Surat,Bardoli,Brinjal,Other,FAQ,08-08-2024,2500,3350,2950,35,2024,8,8,Thursday,3,850,
Gujarat,Surat,Bardoli,Brinjal,Other,FAQ,10-08-2024,2700,3500,2850,35,2024,8,10,Saturday,3,800,
Gujarat,Surat,Bardoli,Brinjal,Other,FAQ,12-08-2024,3500,4000,3750,35,2024,8,12,Monday,3,500,
Gujarat,Surat,Bardoli,Brinjal,Other,FAQ,13-08-2024,3200,3750,3500,35,2024,8,13,Tuesday,3,550,
Gujarat,Surat,Bardoli,Brinjal,Other,FAQ,20-08-2024,2500,3250,2850,35,2024,8,20,Tuesday,3,750,
Gujarat,Surat,Bardoli,Brinjal,Other,FAQ,23-08-2024,2850,3500,3050,35,2024,8,23,Friday,3,650,
Gujarat,Surat,Bardoli,Bhindi,Other,FAQ,02-03-2024,1500,2250,1850,85,2024,3,2,Saturday,1,750,
Gujarat,Surat,Bardoli,Bhindi,Other,FAQ,10-04-2024,4000,4500,4250,85,2024,4,10,Wednesday,2,500,
Gujarat,Surat,Bardoli,Bhindi,Other,FAQ,23-04-2024,1250,2150,1850,85,2024,4,23,Tuesday,2,900,
Gujarat,Surat,Bardoli,Bhindi,Other,FAQ,15-01-2024,1250,2150,1800,85,2024,1,15,Monday,1,900,
Gujarat,Surat,Bardoli,Bhindi,Other,FAQ,08-02-2024,1800,2200,2000,85,2024,2,8,Thursday,1,400,
Gujarat,Surat,Bardoli,Bhindi,Other,FAQ,12-02-2024,2000,2500,2200,85,2024,2,12,Monday,1,500,
Gujarat,Surat,Bardoli,Bhindi,Other,FAQ,22-02-2024,2000,3500,3000,85,2024,2,22,Thursday,1,1500,
Gujarat,Surat,Bardoli,Bhindi,Other,FAQ,30-04-2024,4000,4400,4250,85,2024,4,30,Tuesday,2,400,
Gujarat,Surat,Bardoli,Bhindi,Other,FAQ,10-01-2024,2500,3200,3000,85,2024,1,10,Wednesday,1,700,
Gujarat,Surat,Bardoli,Bhindi,Other,FAQ,17-01-2024,1500,2150,1850,85,2024,1,17,Wednesday,1,650,
Gujarat,Surat,Bardoli,Bhindi,Other,FAQ,14-02-2024,1850,2500,2100,85,2024,2,14,Wednesday,1,650,
Gujarat,Surat,Bardoli,Bhindi,Other,FAQ,19-02-2024,1750,2200,2000,85,2024,2,19,Monday,1,450,
Gujarat,Surat,Bardoli,Bhindi,Other,FAQ,03-04-2024,1500,2150,1850,85,2024,4,3,Wednesday,2,650,
Gujarat,Surat,Bardoli,Bhindi,Other,FAQ,11-12-2024,1500,2500,1850,85,2024,12,11,Wednesday,4,1000,
Gujarat,Surat,Bardoli,Bhindi,Other,FAQ,21-12-2024,1500,2150,1850,85,2024,12,21,Saturday,4,650,
Gujarat,Surat,Bardoli,Bhindi,Other,FAQ,24-12-2024,1500,2150,1850,85,2024,12,24,Tuesday,4,650,
Gujarat,Surat,Bardoli,Bhindi,Other,FAQ,26-12-2024,1250,2250,1850,85,2024,12,26,Thursday,4,1000,
Gujarat,Surat,Bardoli,Bhindi,Other,FAQ,31-12-2024,1000,1850,1250,85,2024,12,31,Tuesday,4,850,
Gujarat,Surat,Bardoli,Brinjal,Other,FAQ,09-12-2024,1850,2850,2150,35,2024,12,9,Monday,4,1000,
Gujarat,Surat,Bardoli,Brinjal,Other,FAQ,11-12-2024,1850,2550,2150,35,2024,12,11,Wednesday,4,700,
Gujarat,Surat,Bardoli,Brinjal,Other,FAQ,31-12-2024,1500,2250,1850,35,2024,12,31,Tuesday,4,750,
Gujarat,Surat,Bardoli,Brinjal,Other,FAQ,03-06-2024,1500,2250,2000,35,2024,6,3,Monday,2,750,
Gujarat,Surat,Bardoli,Brinjal,Other,FAQ,05-06-2024,2000,3000,2500,35,2024,6,5,Wednesday,2,1000,
Gujarat,Surat,Bardoli,Brinjal,Other,FAQ,13-06-2024,2500,3000,2750,35,2024,6,13,Thursday,2,500,
Gujarat,Surat,Bardoli,Brinjal,Other,FAQ,24-06-2024,3000,3500,3250,35,2024,6,24,Monday,2,500,
Gujarat,Surat,Bardoli,Brinjal,Other,FAQ,29-06-2024,3000,3800,3500,35,2024,6,29,Saturday,2,800,
Gujarat,Surat,Bardoli,Bhindi,Other,FAQ,05-07-2024,3000,3500,3250,85,2024,7,5,Friday,3,500,
Gujarat,Surat,Bardoli,Bhindi,Other,FAQ,20-07-2024,2500,3250,2850,85,2024,7,20,Saturday,3,750,
Gujarat,Surat,Bardoli,Bhindi,Other,FAQ,26-07-2024,3500,4200,4000,85,2024,7,26,Friday,3,700,
Gujarat,Surat,Bardoli,Bhindi,Other,FAQ,08-05-2024,4000,4500,4250,85,2024,5,8,Wednesday,2,500,
Gujarat,Surat,Bardoli,Bhindi,Other,FAQ,21-05-2024,4000,4100,4100,85,2024,5,21,Tuesday,2,100,
Gujarat,Surat,Bardoli,Bhindi,Other,FAQ,05-01-2024,3200,4000,3500,85,2024,1,5,Friday,1,800,
Gujarat,Surat,Bardoli,Bhindi,Other,FAQ,21-02-2024,2500,3000,2750,85,2024,2,21,Wednesday,1,500,
Gujarat,Surat,Bardoli,Bhindi,Other,FAQ,13-03-2024,4000,5000,4500,85,2024,3,13,Wednesday,1,1000,
Gujarat,Surat,Bardoli,Bhindi,Other,FAQ,08-04-2024,1250,2150,1850,85,2024,4,8,Monday,2,900,
Gujarat,Surat,Bardoli,Bhindi,Other,FAQ,12-04-2024,4000,4500,4250,85,2024,4,12,Friday,2,500,
Gujarat,Surat,Bardoli,Bhindi,Other,FAQ,24-04-2024,1250,2100,1850,85,2024,4,24,Wednesday,2,850,
Gujarat,Surat,Bardoli,Bhindi,Other,FAQ,04-01-2024,3200,4000,3500,85,2024,1,4,Thursday,1,800,
Gujarat,Surat,Bardoli,Bhindi,Other,FAQ,16-01-2024,2000,3200,2500,85,2024,1,16,Tuesday,1,1200,
Gujarat,Surat,Bardoli,Bhindi,Other,FAQ,23-01-2024,2000,3000,2500,85,2024,1,23,Tuesday,1,1000,
Gujarat,Surat,Bardoli,Bhindi,Other,FAQ,31-01-2024,1500,2150,1850,85,2024,1,31,Wednesday,1,650,
Gujarat,Surat,Bardoli,Bhindi,Other,FAQ,13-02-2024,1800,2200,2000,85,2024,2,13,Tuesday,1,400,
Gujarat,Surat,Bardoli,Bhindi,Other,FAQ,14-03-2024,4000,4500,4250,85,2024,3,14,Thursday,1,500,
Gujarat,Surat,Bardoli,Bhindi,Other,FAQ,20-03-2024,1250,1950,1550,85,2024,3,20,Wednesday,1,700,
Gujarat,Surat,Bardoli,Brinjal,Other,FAQ,04-01-2024,3200,3800,3500,35,2024,1,4,Thursday,1,600,
Gujarat,Surat,Bardoli,Brinjal,Other,FAQ,05-01-2024,3500,4000,3750,35,2024,1,5,Friday,1,500,
Gujarat,Surat,Bardoli,Brinjal,Other,FAQ,09-01-2024,3200,3750,3500,35,2024,1,9,Tuesday,1,550,
Gujarat,Surat,Bardoli,Brinjal,Other,FAQ,31-01-2024,1850,2250,2100,35,2024,1,31,Wednesday,1,400,
Gujarat,Surat,Bardoli,Brinjal,Other,FAQ,28-02-2024,1500,2250,1750,35,2024,2,28,Wednesday,1,750,
Gujarat,Surat,Bardoli,Brinjal,Other,FAQ,16-03-2024,1750,2200,2000,35,2024,3,16,Saturday,1,450,
Gujarat,Surat,Bardoli,Brinjal,Other,FAQ,19-03-2024,1500,1950,1800,35,2024,3,19,Tuesday,1,450,
Gujarat,Surat,Bardoli,Brinjal,Other,FAQ,20-03-2024,1500,2250,1850,35,2024,3,20,Wednesday,1,750,
Gujarat,Surat,Bardoli,Brinjal,Other,FAQ,22-03-2024,1250,2150,1850,35,2024,3,22,Friday,1,900,
Gujarat,Surat,Bardoli,Brinjal,Other,FAQ,27-03-2024,2000,3000,2250,35,2024,3,27,Wednesday,1,1000,
Gujarat,Surat,Bardoli,Brinjal,Other,FAQ,30-03-2024,2000,2500,2250,35,2024,3,30,Saturday,1,500,
Gujarat,Surat,Bardoli,Brinjal,Other,FAQ,12-04-2024,1800,2500,2250,35,2024,4,12,Friday,2,700,
Gujarat,Surat,Bardoli,Bhindi,Other,FAQ,15-10-2024,2500,3500,3000,85,2024,10,15,Tuesday,4,1000,
Gujarat,Surat,Bardoli,Bhindi,Other,FAQ,09-10-2024,2500,3500,3000,85,2024,10,9,Wednesday,4,1000,
Gujarat,Surat,Bardoli,Bhindi,Other,FAQ,14-10-2024,1580,2500,1850,85,2024,10,14,Monday,4,920,
Gujarat,Surat,Bardoli,Bhindi,Other,FAQ,24-10-2024,3000,4000,3500,85,2024,10,24,Thursday,4,1000,
Gujarat,Surat,Bardoli,Bhindi,Other,FAQ,25-10-2024,1500,2850,2150,85,2024,10,25,Friday,4,1350,
Gujarat,Surat,Bardoli,Bhindi,Other,FAQ,02-09-2024,2500,3500,3000,85,2024,9,2,Monday,3,1000,
Gujarat,Surat,Bardoli,Bhindi,Other,FAQ,11-09-2024,2500,3200,2750,85,2024,9,11,Wednesday,3,700,
Gujarat,Surat,Bardoli,Bhindi,Other,FAQ,13-09-2024,3000,4200,3500,85,2024,9,13,Friday,3,1200,
Gujarat,Surat,Bardoli,Bhindi,Other,FAQ,21-09-2024,3000,4000,3500,85,2024,9,21,Saturday,3,1000,
Gujarat,Surat,Bardoli,Bhindi,Other,FAQ,26-09-2024,2500,3050,2850,85,2024,9,26,Thursday,3,550,
Gujarat,Surat,Bardoli,Bhindi,Other,FAQ,27-09-2024,3500,4000,3750,85,2024,9,27,Friday,3,500,
Gujarat,Surat,Bardoli,Bhindi,Other,FAQ,23-10-2024,1550,2500,2150,85,2024,10,23,Wednesday,4,950,
Gujarat,Surat,Bardoli,Bhindi,Other,FAQ,13-11-2024,2000,2500,2250,85,2024,11,13,Wednesday,4,500,
Gujarat,Surat,Bardoli,Brinjal,Other,FAQ,07-10-2024,1850,2500,2150,35,2024,10,7,Monday,4,650,
Gujarat,Surat,Bardoli,Brinjal,Other,FAQ,14-11-2024,1850,3050,2500,35,2024,11,14,Thursday,4,1200,
Gujarat,Surat,Bardoli,Bhindi,Other,FAQ,15-06-2024,3000,3700,3500,85,2024,6,15,Saturday,2,700,
Gujarat,Surat,Bardoli,Bhindi,Other,FAQ,19-06-2024,3200,3500,3500,85,2024,6,19,Wednesday,2,300,
Gujarat,Surat,Bardoli,Brinjal,Other,FAQ,01-08-2024,3500,4000,3750,35,2024,8,1,Thursday,3,500,
Gujarat,Surat,Bardoli,Brinjal,Other,FAQ,02-08-2024,3000,4000,3750,35,2024,8,2,Friday,3,1000,
Gujarat,Surat,Bardoli,Brinjal,Other,FAQ,07-08-2024,2500,3500,3250,35,2024,8,7,Wednesday,3,1000,
Gujarat,Surat,Bardoli,Brinjal,Other,FAQ,21-08-2024,3500,4500,4000,35,2024,8,21,Wednesday,3,1000,
Gujarat,Surat,Bardoli,Brinjal,Other,FAQ,22-08-2024,4000,4500,4200,35,2024,8,22,Thursday,3,500,
Gujarat,Surat,Bardoli,Brinjal,Other,FAQ,28-08-2024,2500,3500,3250,35,2024,8,28,Wednesday,3,1000,
Gujarat,Surat,Bardoli,Brinjal,Other,FAQ,11-10-2024,1850,2550,2150,35,2024,10,11,Friday,4,700,
Gujarat,Surat,Bardoli,Brinjal,Other,FAQ,26-10-2024,1850,2850,2150,35,2024,10,26,Saturday,4,1000,
Gujarat,Surat,Bardoli,Brinjal,Other,FAQ,05-07-2024,3500,4000,3750,35,2024,7,5,Friday,3,500,
Gujarat,Surat,Bardoli,Brinjal,Other,FAQ,09-07-2024,3500,4000,3750,35,2024,7,9,Tuesday,3,500,
Gujarat,Surat,Bardoli,Brinjal,Other,FAQ,19-07-2024,3500,4000,3750,35,2024,7,19,Friday,3,500,
Gujarat,Surat,Bardoli,Brinjal,Other,FAQ,25-07-2024,3500,4100,3800,35,2024,7,25,Thursday,3,600,
Gujarat,Surat,Bardoli,Brinjal,Other,FAQ,02-05-2024,1250,2200,1850,35,2024,5,2,Thursday,2,950,
Gujarat,Surat,Bardoli,Brinjal,Other,FAQ,03-05-2024,2000,2500,2250,35,2024,5,3,Friday,2,500,
Gujarat,Surat,Bardoli,Brinjal,Other,FAQ,09-05-2024,2000,2500,2250,35,2024,5,9,Thursday,2,500,
Gujarat,Surat,Bardoli,Brinjal,Other,FAQ,21-05-2024,2125,2150,2125,35,2024,5,21,Tuesday,2,25,
Gujarat,Surat,Bardoli,Brinjal,Other,FAQ,23-05-2024,2000,2500,2250,35,2024,5,23,Thursday,2,500,
Gujarat,Surat,Bardoli,Bhindi,Other,FAQ,06-05-2024,3500,4200,4000,85,2024,5,6,Monday,2,700,
Gujarat,Surat,Bardoli,Bhindi,Other,FAQ,24-05-2024,4000,4500,4200,85,2024,5,24,Friday,2,500,
Gujarat,Surat,Bardoli,Brinjal,Other,FAQ,04-11-2024,2000,3500,2550,35,2024,11,4,Monday,4,1500,
Gujarat,Surat,Bardoli,Brinjal,Other,FAQ,23-11-2024,1550,2250,2150,35,2024,11,23,Saturday,4,700,
Gujarat,Surat,Bardoli,Bhindi,Other,FAQ,07-08-2024,2500,3500,2750,85,2024,8,7,Wednesday,3,1000,
Gujarat,Surat,Bardoli,Bhindi,Other,FAQ,14-08-2024,3000,4000,3500,85,2024,8,14,Wednesday,3,1000,
Gujarat,Surat,Bardoli,Bhindi,Other,FAQ,16-08-2024,3000,3800,3500,85,2024,8,16,Friday,3,800,
Gujarat,Surat,Bardoli,Bhindi,Other,FAQ,17-08-2024,3000,3750,3500,85,2024,8,17,Saturday,3,750,
Gujarat,Surat,Bardoli,Bhindi,Other,FAQ,20-08-2024,2500,3500,2950,85,2024,8,20,Tuesday,3,1000,
Gujarat,Surat,Bardoli,Bhindi,Other,FAQ,29-08-2024,2000,3000,2500,85,2024,8,29,Thursday,3,1000,
Gujarat,Surat,Bardoli,Bhindi,Other,FAQ,30-08-2024,2000,3000,2500,85,2024,8,30,Friday,3,1000,
Gujarat,Surat,Bardoli,Brinjal,Other,FAQ,30-09-2024,3500,4000,3750,35,2024,9,30,Monday,3,500,
Gujarat,Surat,Bardoli,Bhindi,Other,FAQ,08-01-2024,1800,3500,2500,85,2024,1,8,Monday,1,1700,
Gujarat,Surat,Bardoli,Bhindi,Other,FAQ,12-01-2024,1800,2400,2000,85,2024,1,12,Friday,1,600,
Gujarat,Surat,Bardoli,Bhindi,Other,FAQ,29-01-2024,2000,3000,2500,85,2024,1,29,Monday,1,1000,
Gujarat,Surat,Bardoli,Bhindi,Other,FAQ,20-02-2024,1800,2400,2000,85,2024,2,20,Tuesday,1,600,
Gujarat,Surat,Bardoli,Bhindi,Other,FAQ,09-03-2024,3500,4500,4000,85,2024,3,9,Saturday,1,1000,
Gujarat,Surat,Bardoli,Bhindi,Other,FAQ,16-03-2024,3500,4500,4000,85,2024,3,16,Saturday,1,1000,
Gujarat,Surat,Bardoli,Bhindi,Other,FAQ,26-03-2024,1250,1950,1550,85,2024,3,26,Tuesday,1,700,
Gujarat,Surat,Bardoli,Bhindi,Other,FAQ,27-03-2024,3500,4500,4000,85,2024,3,27,Wednesday,1,1000,
Gujarat,Surat,Bardoli,Bhindi,Other,FAQ,13-04-2024,4000,4500,4250,85,2024,4,13,Saturday,2,500,
Gujarat,Surat,Bardoli,Bhindi,Other,FAQ,15-04-2024,4000,4500,4200,85,2024,4,15,Monday,2,500,
Gujarat,Surat,Bardoli,Bhindi,Other,FAQ,18-04-2024,4000,4500,4250,85,2024,4,18,Thursday,2,500,
Gujarat,Surat,Bardoli,Brinjal,Other,FAQ,24-05-2024,2000,2500,2250,35,2024,5,24,Friday,2,500,
Gujarat,Surat,Bardoli,Brinjal,Other,FAQ,28-05-2024,1500,2250,1850,35,2024,5,28,Tuesday,2,750,
Gujarat,Surat,Bardoli,Bhindi,Other,FAQ,03-06-2024,1250,2150,1850,85,2024,6,3,Monday,2,900,
Gujarat,Surat,Bardoli,Bhindi,Other,FAQ,08-06-2024,1500,2150,1850,85,2024,6,8,Saturday,2,650,
Gujarat,Surat,Bardoli,Bhindi,Other,FAQ,10-06-2024,1250,2150,1850,85,2024,6,10,Monday,2,900,
Gujarat,Surat,Bardoli,Bhindi,Other,FAQ,11-06-2024,3000,4000,3500,85,2024,6,11,Tuesday,2,1000,
Gujarat,Surat,Bardoli,Bhindi,Other,FAQ,25-06-2024,1250,2100,1850,85,2024,6,25,Tuesday,2,850,
Gujarat,Surat,Bardoli,Bhindi,Other,FAQ,11-05-2024,4000,4500,4250,85,2024,5,11,Saturday,2,500,
Gujarat,Surat,Bardoli,Bhindi,Other,FAQ,20-05-2024,4000,4125,4125,85,2024,5,20,Monday,2,125,
Gujarat,Surat,Bardoli,Brinjal,Other,FAQ,17-01-2024,1850,2100,2000,35,2024,1,17,Wednesday,1,250,
Gujarat,Surat,Bardoli,Brinjal,Other,FAQ,08-02-2024,2000,2500,2250,35,2024,2,8,Thursday,1,500,
Gujarat,Surat,Bardoli,Brinjal,Other,FAQ,12-02-2024,1800,2250,2000,35,2024,2,12,Monday,1,450,
Gujarat,Surat,Bardoli,Brinjal,Other,FAQ,19-02-2024,1800,2250,2000,35,2024,2,19,Monday,1,450,
Gujarat,Surat,Bardoli,Brinjal,Other,FAQ,01-03-2024,1750,2250,2000,35,2024,3,1,Friday,1,500,
Gujarat,Surat,Bardoli,Brinjal,Other,FAQ,09-03-2024,1500,2500,2000,35,2024,3,9,Saturday,1,1000,
Gujarat,Surat,Bardoli,Brinjal,Other,FAQ,18-03-2024,2000,2500,2250,35,2024,3,18,Monday,1,500,
Gujarat,Surat,Bardoli,Brinjal,Other,FAQ,21-03-2024,1850,2250,2000,35,2024,3,21,Thursday,1,400,
Gujarat,Surat,Bardoli,Brinjal,Other,FAQ,23-03-2024,2000,2500,2250,35,2024,3,23,Saturday,1,500,
Gujarat,Surat,Bardoli,Brinjal,Other,FAQ,04-04-2024,1800,2300,2000,35,2024,4,4,Thursday,2,500,
Gujarat,Surat,Bardoli,Brinjal,Other,FAQ,08-04-2024,1250,1850,1550,35,2024,4,8,Monday,2,600,
Gujarat,Surat,Bardoli,Brinjal,Other,FAQ,18-04-2024,2000,2500,2250,35,2024,4,18,Thursday,2,500,
Gujarat,Surat,Bardoli,Brinjal,Other,FAQ,26-04-2024,1250,2100,1550,35,2024,4,26,Friday,2,850,
Gujarat,Surat,Bardoli,Brinjal,Other,FAQ,06-06-2024,1500,2400,1850,35,2024,6,6,Thursday,2,900,
Gujarat,Surat,Bardoli,Brinjal,Other,FAQ,08-06-2024,1850,2250,2150,35,2024,6,8,Saturday,2,400,
Gujarat,Surat,Bardoli,Brinjal,Other,FAQ,12-06-2024,2300,2750,2500,35,2024,6,12,Wednesday,2,450,
Gujarat,Surat,Bardoli,Brinjal,Other,FAQ,26-06-2024,3500,4000,3750,35,2024,6,26,Wednesday,2,500,
Gujarat,Surat,Bardoli,Bhindi,Other,FAQ,03-05-2024,4000,4500,4250,85,2024,5,3,Friday,2,500,
Gujarat,Surat,Bardoli,Bhindi,Other,FAQ,31-05-2024,3500,4000,3700,85,2024,5,31,Friday,2,500,
Gujarat,Surat,Bardoli,Brinjal,Other,FAQ,16-05-2024,2000,2500,2250,35,2024,5,16,Thursday,2,500,
Gujarat,Surat,Bardoli,Brinjal,Other,FAQ,30-05-2024,2000,2500,2250,35,2024,5,30,Thursday,2,500,
Gujarat,Surat,Bardoli,Brinjal,Other,FAQ,02-09-2024,3000,3750,3500,35,2024,9,2,Monday,3,750,
Gujarat,Surat,Bardoli,Brinjal,Other,FAQ,03-09-2024,3000,3750,3500,35,2024,9,3,Tuesday,3,750,
Gujarat,Surat,Bardoli,Brinjal,Other,FAQ,09-09-2024,3000,3750,3500,35,2024,9,9,Monday,3,750,
Gujarat,Surat,Bardoli,Brinjal,Other,FAQ,20-09-2024,2250,3050,2550,35,2024,9,20,Friday,3,800,
Gujarat,Surat,Bardoli,Bhindi,Other,FAQ,03-09-2024,2500,3200,3000,85,2024,9,3,Tuesday,3,700,
Gujarat,Surat,Bardoli,Bhindi,Other,FAQ,18-09-2024,2000,3000,2500,85,2024,9,18,Wednesday,3,1000,
Gujarat,Surat,Bardoli,Bhindi,Other,FAQ,30-09-2024,3000,3750,3500,85,2024,9,30,Monday,3,750,
Gujarat,Surat,Bardoli,Brinjal,Other,FAQ,21-10-2024,1850,2500,2150,35,2024,10,21,Monday,4,650,
Gujarat,Surat,Bardoli,Brinjal,Other,FAQ,28-10-2024,1550,2950,2150,35,2024,10,28,Monday,4,1400,
Gujarat,Surat,Bardoli,Brinjal,Other,FAQ,09-10-2024,3500,4000,3750,35,2024,10,9,Wednesday,4,500,
Gujarat,Surat,Bardoli,Bhindi,Other,FAQ,12-08-2024,3000,4000,3500,85,2024,8,12,Monday,3,1000,
Gujarat,Surat,Bardoli,Bhindi,Other,FAQ,13-08-2024,3500,4200,4000,85,2024,8,13,Tuesday,3,700,
Gujarat,Surat,Bardoli,Bhindi,Other,FAQ,28-08-2024,3250,3500,3300,85,2024,8,28,Wednesday,3,250,
Gujarat,Surat,Bardoli,Brinjal,Other,FAQ,01-07-2024,3000,3500,3250,35,2024,7,1,Monday,3,500,
Gujarat,Surat,Bardoli,Brinjal,Other,FAQ,15-07-2024,3500,4500,4000,35,2024,7,15,Monday,3,1000,
Gujarat,Surat,Bardoli,Brinjal,Other,FAQ,16-07-2024,3500,4000,3750,35,2024,7,16,Tuesday,3,500,
Gujarat,Surat,Bardoli,Brinjal,Other,FAQ,29-07-2024,3500,4200,4000,35,2024,7,29,Monday,3,700,
Gujarat,Surat,Bardoli,Brinjal,Other,FAQ,05-08-2024,3000,4000,3500,35,2024,8,5,Monday,3,1000,
Gujarat,Surat,Bardoli,Brinjal,Other,FAQ,14-08-2024,3000,3750,3500,35,2024,8,14,Wednesday,3,750,
Gujarat,Surat,Bardoli,Brinjal,Other,FAQ,16-08-2024,3500,4000,3750,35,2024,8,16,Friday,3,500,
Gujarat,Surat,Bardoli,Brinjal,Other,FAQ,24-08-2024,3500,4250,4000,35,2024,8,24,Saturday,3,750,
Gujarat,Surat,Bardoli,Brinjal,Other,FAQ,27-08-2024,2850,3500,3200,35,2024,8,27,Tuesday,3,650,
Gujarat,Surat,Bardoli,Brinjal,Other,FAQ,31-08-2024,2500,3250,2750,35,2024,8,31,Saturday,3,750,
Gujarat,Surat,Bardoli,Bhindi,Other,FAQ,04-07-2024,3000,4000,3500,85,2024,7,4,Thursday,3,1000,
Gujarat,Surat,Bardoli,Bhindi,Other,FAQ,06-07-2024,3000,3500,3250,85,2024,7,6,Saturday,3,500,
Gujarat,Surat,Bardoli,Bhindi,Other,FAQ,08-07-2024,3000,3750,3500,85,2024,7,8,Monday,3,750,
Gujarat,Surat,Bardoli,Bhindi,Other,FAQ,17-07-2024,1500,3500,2500,85,2024,7,17,Wednesday,3,2000,
Gujarat,Surat,Bardoli,Bhindi,Other,FAQ,24-07-2024,3500,3750,3750,85,2024,7,24,Wednesday,3,250,
Gujarat,Surat,Bardoli,Bhindi,Other,FAQ,04-11-2024,1850,3250,2550,85,2024,11,4,Monday,4,1400,
Gujarat,Surat,Bardoli,Bhindi,Other,FAQ,21-11-2024,1500,2500,1850,85,2024,11,21,Thursday,4,1000,
Gujarat,Surat,Bardoli,Bhindi,Other,FAQ,25-11-2024,1250,2250,1550,85,2024,11,25,Monday,4,1000,
Gujarat,Surat,Bardoli,Brinjal,Other,FAQ,09-11-2024,2150,3200,2550,35,2024,11,9,Saturday,4,1050,
Gujarat,Surat,Bardoli,Brinjal,Other,FAQ,27-11-2024,1850,2500,2150,35,2024,11,27,Wednesday,4,650,
Gujarat,Surat,Bardoli,Bhindi,Other,FAQ,05-12-2024,2500,2875,2875,85,2024,12,5,Thursday,4,375,
Gujarat,Surat,Bardoli,Brinjal,Other,FAQ,05-12-2024,2500,2750,2750,35,2024,12,5,Thursday,4,250,
Gujarat,Surat,Bardoli,Brinjal,Other,FAQ,20-12-2024,1500,2500,2150,35,2024,12,20,Friday,4,1000,
Gujarat,Surat,Bardoli,Brinjal,Other,FAQ,23-12-2024,1850,2550,2150,35,2024,12,23,Monday,4,700,
Gujarat,Surat,Bardoli,Brinjal,Other,FAQ,24-12-2024,1550,2550,1950,35,2024,12,24,Tuesday,4,1000,
Gujarat,Surat,Bardoli,Paddy(Dhan),Other,FAQ,07-06-2024,2200,2355,2300,2,2024,6,7,Friday,2,155,
Gujarat,Surat,Bardoli,Paddy(Dhan),Other,FAQ,10-06-2024,2000,2150,2050,2,2024,6,10,Monday,2,150,
Gujarat,Surat,Bardoli,Paddy(Dhan),Other,FAQ,05-06-2024,2300,2500,2400,2,2024,6,5,Wednesday,2,200,
Gujarat,Surat,Bardoli,Paddy(Dhan),Other,FAQ,13-06-2024,2350,2375,2355,2,2024,6,13,Thursday,2,25,
Gujarat,Surat,Bardoli,Paddy(Dhan),Other,FAQ,22-06-2024,2350,2380,2375,2,2024,6,22,Saturday,2,30,
Gujarat,Surat,Bardoli,Paddy(Dhan),Other,FAQ,06-12-2024,2250,2355,2355,2,2024,12,6,Friday,4,105,
Gujarat,Surat,Bardoli,Paddy(Dhan),Other,FAQ,07-12-2024,2355,2450,2400,2,2024,12,7,Saturday,4,95,
Gujarat,Surat,Bardoli,Paddy(Dhan),Other,FAQ,13-12-2024,2900,3100,2950,2,2024,12,13,Friday,4,200,
Gujarat,Surat,Bardoli,Paddy(Dhan),Other,FAQ,07-11-2024,2900,3050,2950,2,2024,11,7,Thursday,4,150,
Gujarat,Surat,Bardoli,Paddy(Dhan),Other,FAQ,25-11-2024,2900,3100,3050,2,2024,11,25,Monday,4,200,
Gujarat,Surat,Bardoli,Paddy(Dhan),Other,FAQ,09-11-2024,2900,3050,2950,2,2024,11,9,Saturday,4,150,
Gujarat,Surat,Bardoli,Paddy(Dhan),Other,FAQ,26-11-2024,2070,2355,2355,2,2024,11,26,Tuesday,4,285,
Gujarat,Surat,Bardoli,Paddy(Dhan),Other,FAQ,10-12-2024,2900,3100,2950,2,2024,12,10,Tuesday,4,200,
Gujarat,Surat,Bardoli,Paddy(Dhan),Other,FAQ,17-12-2024,2950,3100,3050,2,2024,12,17,Tuesday,4,150,
Gujarat,Surat,Bardoli,Paddy(Dhan),Other,FAQ,23-05-2024,3200,3500,3325,2,2024,5,23,Thursday,2,300,
Gujarat,Surat,Bardoli,Paddy(Dhan),Other,FAQ,18-06-2024,2350,2375,2355,2,2024,6,18,Tuesday,2,25,
Gujarat,Surat,Bardoli,Paddy(Dhan),Other,FAQ,13-11-2024,2900,3050,2950,2,2024,11,13,Wednesday,4,150,
Gujarat,Surat,Bardoli,Paddy(Dhan),Other,FAQ,22-11-2024,2900,3100,3050,2,2024,11,22,Friday,4,200,
Gujarat,Surat,Bardoli,Paddy(Dhan),Other,FAQ,23-11-2024,2900,3100,3050,2,2024,11,23,Saturday,4,200,
Gujarat,Surat,Bardoli,Paddy(Dhan),Other,FAQ,27-11-2024,2900,3100,3050,2,2024,11,27,Wednesday,4,200,
Gujarat,Surat,Bardoli,Paddy(Dhan),Other,FAQ,21-05-2024,2140,2355,2355,2,2024,5,21,Tuesday,2,215,
Gujarat,Surat,Bardoli,Paddy(Dhan),Other,FAQ,25-05-2024,2300,2500,2350,2,2024,5,25,Saturday,2,200,
Gujarat,Surat,Bardoli,Paddy(Dhan),Other,FAQ,28-05-2024,1850,2050,1900,2,2024,5,28,Tuesday,2,200,
Gujarat,Surat,Bardoli,Paddy(Dhan),Other,FAQ,30-05-2024,2350,2400,2370,2,2024,5,30,Thursday,2,50,
Gujarat,Surat,Bardoli,Paddy(Dhan),Other,FAQ,31-05-2024,2400,2475,2450,2,2024,5,31,Friday,2,75,
Gujarat,Surat,Bardoli,Paddy(Dhan),Other,FAQ,24-05-2024,2200,2400,2350,2,2024,5,24,Friday,2,200,
Gujarat,Surat,Bardoli,Paddy(Dhan),Other,FAQ,06-06-2024,2000,2150,2050,2,2024,6,6,Thursday,2,150,
Gujarat,Surat,Bardoli,Paddy(Dhan),Other,FAQ,12-06-2024,2300,2400,2350,2,2024,6,12,Wednesday,2,100,
Gujarat,Surat,Bardoli,Paddy(Dhan),Other,FAQ,09-12-2024,2900,3000,2950,2,2024,12,9,Monday,4,100,
Gujarat,Surat,Bardoli,Paddy(Dhan),Other,FAQ,14-12-2024,2900,3100,2950,2,2024,12,14,Saturday,4,200,
Gujarat,Surat,Bardoli,Paddy(Dhan),Other,FAQ,18-12-2024,2900,3100,3000,2,2024,12,18,Wednesday,4,200,
Gujarat,Surat,Bardoli,Paddy(Dhan),Other,FAQ,03-06-2024,2000,2100,2050,2,2024,6,3,Monday,2,100,
Gujarat,Surat,Bardoli,Paddy(Dhan),Other,FAQ,04-06-2024,1950,2150,2000,2,2024,6,4,Tuesday,2,200,
Gujarat,Surat,Bardoli,Paddy(Dhan),Other,FAQ,11-06-2024,2350,2400,2370,2,2024,6,11,Tuesday,2,50,
Gujarat,Surat,Bardoli,Paddy(Dhan),Other,FAQ,08-06-2024,2000,2100,2050,2,2024,6,8,Saturday,2,100,
Gujarat,Surat,Bardoli,Paddy(Dhan),Other,FAQ,19-11-2024,2900,3100,2950,2,2024,11,19,Tuesday,4,200,
Gujarat,Surat,Bardoli,Paddy(Dhan),Other,FAQ,20-11-2024,2900,3100,2950,2,2024,11,20,Wednesday,4,200,
Gujarat,Surat,Bardoli,Paddy(Dhan),Other,FAQ,21-11-2024,2900,3100,3000,2,2024,11,21,Thursday,4,200,
Gujarat,Surat,Bardoli,Paddy(Dhan),Other,FAQ,29-11-2024,2900,3100,2950,2,2024,11,29,Friday,4,200,
Gujarat,Surat,Bardoli,Paddy(Dhan),Other,FAQ,15-06-2024,2300,2380,2350,2,2024,6,15,Saturday,2,80,
Gujarat,Surat,Bardoli,Paddy(Dhan),Other,FAQ,19-06-2024,2340,2355,2350,2,2024,6,19,Wednesday,2,15,
Gujarat,Surat,Bardoli,Paddy(Dhan),Other,FAQ,20-06-2024,2300,2375,2350,2,2024,6,20,Thursday,2,75,
Gujarat,Surat,Bardoli,Paddy(Dhan),Other,FAQ,27-05-2024,2150,2250,2200,2,2024,5,27,Monday,2,100,
Gujarat,Surat,Bardoli,Paddy(Dhan),Other,FAQ,05-11-2024,2900,3000,2950,2,2024,11,5,Tuesday,4,100,
Gujarat,Surat,Bardoli,Paddy(Dhan),Other,FAQ,11-11-2024,2900,3050,2950,2,2024,11,11,Monday,4,150,
Gujarat,Surat,Bardoli,Paddy(Dhan),Other,FAQ,14-11-2024,2900,3050,2950,2,2024,11,14,Thursday,4,150,
Gujarat,Surat,Bardoli,Paddy(Dhan),Other,FAQ,05-12-2024,2214,2355,2355,2,2024,12,5,Thursday,4,141,
Gujarat,Surat,Bardoli,Paddy(Dhan),Other,FAQ,11-12-2024,2900,3100,2950,2,2024,12,11,Wednesday,4,200,
Gujarat,Surat,Kosamba,Paddy(Dhan),Other,FAQ,31-05-2024,2300,2400,2350,2,2024,5,31,Friday,2,100,
Gujarat,Surat,Kosamba,Paddy(Dhan),Other,FAQ,08-11-2024,2000,2150,2100,2,2024,11,8,Friday,4,150,
Gujarat,Surat,Kosamba,Paddy(Dhan),Other,FAQ,22-11-2024,2000,2300,2150,2,2024,11,22,Friday,4,300,
Gujarat,Surat,Kosamba,Paddy(Dhan),Other,FAQ,24-10-2024,2010,2200,2100,2,2024,10,24,Thursday,4,190,
Gujarat,Surat,Kosamba,Paddy(Dhan),Other,FAQ,20-05-2024,2000,2100,2000,2,2024,5,20,Monday,2,100,
Gujarat,Surat,Kosamba,Paddy(Dhan),Other,FAQ,22-05-2024,2300,2350,2325,2,2024,5,22,Wednesday,2,50,
Gujarat,Surat,Kosamba,Paddy(Dhan),Other,FAQ,30-05-2024,2300,2500,2350,2,2024,5,30,Thursday,2,200,
Gujarat,Surat,Kosamba,Jowar(Sorghum),Annigeri,FAQ,15-01-2024,2500,2600,2550,5,2024,1,15,Monday,1,100,
Gujarat,Surat,Kosamba,Paddy(Dhan),Other,FAQ,07-11-2024,2000,2150,2100,2,2024,11,7,Thursday,4,150,
Gujarat,Surat,Kosamba,Paddy(Dhan),Other,FAQ,12-11-2024,2000,2200,2100,2,2024,11,12,Tuesday,4,200,
Gujarat,Surat,Kosamba,Paddy(Dhan),Other,FAQ,15-11-2024,1950,2100,2000,2,2024,11,15,Friday,4,150,
Gujarat,Surat,Kosamba,Paddy(Dhan),Other,FAQ,27-05-2024,2150,2250,2200,2,2024,5,27,Monday,2,100,
Gujarat,Surat,Kosamba,Paddy(Dhan),Other,FAQ,11-11-2024,2000,2200,2100,2,2024,11,11,Monday,4,200,
Gujarat,Surat,Kosamba,Paddy(Dhan),Other,FAQ,18-10-2024,2000,2150,2100,2,2024,10,18,Friday,4,150,
Gujarat,Surat,Kosamba,Paddy(Dhan),Other,FAQ,17-10-2024,2000,2100,2050,2,2024,10,17,Thursday,4,100,
Gujarat,Surat,Kosamba,Paddy(Dhan),Other,FAQ,25-10-2024,2000,2200,2100,2,2024,10,25,Friday,4,200,
Gujarat,Surat,Kosamba,Paddy(Dhan),Other,FAQ,22-05-2024,2300,2375,2325,2,2024,5,22,Wednesday,2,75,
Gujarat,Surat,Kosamba,Paddy(Dhan),Other,FAQ,30-05-2024,2200,2300,2200,2,2024,5,30,Thursday,2,100,
Gujarat,Surat,Kosamba,Paddy(Dhan),Other,FAQ,31-05-2024,2300,2500,2400,2,2024,5,31,Friday,2,200,
Gujarat,Surat,Kosamba,Paddy(Dhan),Other,FAQ,06-06-2024,2250,2400,2300,2,2024,6,6,Thursday,2,150,
Gujarat,Surat,Kosamba,Paddy(Dhan),Other,FAQ,28-05-2024,2100,2200,2150,2,2024,5,28,Tuesday,2,100,
Gujarat,Surat,Kosamba,Paddy(Dhan),Other,FAQ,22-05-2024,2280,2375,2300,2,2024,5,22,Wednesday,2,95,
Gujarat,Surat,Kosamba,Paddy(Dhan),Other,FAQ,30-05-2024,2300,2400,2350,2,2024,5,30,Thursday,2,100,
Gujarat,Surat,Kosamba,Wheat,Other,FAQ,23-05-2024,2275,2350,2300,1,2024,5,23,Thursday,2,75,
Gujarat,Surat,Kosamba,Paddy(Dhan),Other,FAQ,06-06-2024,2300,2400,2350,2,2024,6,6,Thursday,2,100,
Gujarat,Surat,Kosamba,Paddy(Dhan),Other,FAQ,31-05-2024,2300,2400,2350,2,2024,5,31,Friday,2,100,
Gujarat,Surat,Kosamba,Paddy(Dhan),Other,FAQ,28-05-2024,2100,2350,2300,2,2024,5,28,Tuesday,2,250,
Gujarat,Surat,Mahuva,Bhindi,Other,FAQ,23-08-2024,1000,1000,1000,85,2024,8,23,Friday,3,0,
Gujarat,Surat,Mahuva,Paddy(Dhan),Jaya,FAQ,15-06-2024,2200,2400,2300,2,2024,6,15,Saturday,2,200,
Gujarat,Surat,Mahuva,Paddy(Dhan),Jaya,FAQ,06-06-2024,2400,2600,2500,2,2024,6,6,Thursday,2,200,
Gujarat,Surat,Mahuva,Paddy(Dhan),Jaya,FAQ,10-06-2024,2300,2500,2400,2,2024,6,10,Monday,2,200,
Gujarat,Surat,Mahuva,Bhindi,Other,FAQ,03-09-2024,2400,2550,2500,85,2024,9,3,Tuesday,3,150,
Gujarat,Surat,Mahuva,Paddy(Dhan),Jaya,FAQ,12-11-2024,2000,2075,2050,2,2024,11,12,Tuesday,4,75,
Gujarat,Surat,Mahuva,Paddy(Dhan),Jaya,FAQ,20-11-2024,2100,2250,2200,2,2024,11,20,Wednesday,4,150,
Gujarat,Surat,Mahuva,Paddy(Dhan),Jaya,FAQ,23-05-2024,2300,2500,2400,2,2024,5,23,Thursday,2,200,
Gujarat,Surat,Mahuva,Bhindi,Other,FAQ,18-06-2024,3800,3900,3870,85,2024,6,18,Tuesday,2,100,
Gujarat,Surat,Mahuva,Paddy(Dhan),Jaya,FAQ,08-06-2024,1800,2350,2200,2,2024,6,8,Saturday,2,550,
Gujarat,Surat,Mahuva,Paddy(Dhan),Jaya,FAQ,13-06-2024,2300,2500,2400,2,2024,6,13,Thursday,2,200,
Gujarat,Surat,Mahuva,Paddy(Dhan),Jaya,FAQ,14-06-2024,2300,2500,2400,2,2024,6,14,Friday,2,200,
Gujarat,Surat,Mahuva,Paddy(Dhan),Jaya,FAQ,01-06-2024,1800,2350,2200,2,2024,6,1,Saturday,2,550,
Gujarat,Surat,Mahuva,Paddy(Dhan),Jaya,FAQ,03-06-2024,1800,2350,2200,2,2024,6,3,Monday,2,550,
Gujarat,Surat,Mahuva,Paddy(Dhan),Jaya,FAQ,05-06-2024,2300,2500,2400,2,2024,6,5,Wednesday,2,200,
Gujarat,Surat,Mahuva,Paddy(Dhan),Jaya,FAQ,19-06-2024,2200,2400,2300,2,2024,6,19,Wednesday,2,200,
Gujarat,Surat,Mahuva,Paddy(Dhan),Jaya,FAQ,11-06-2024,2200,2400,2300,2,2024,6,11,Tuesday,2,200,
Gujarat,Surat,Mahuva,Bhindi,Other,FAQ,27-08-2024,900,1050,1000,85,2024,8,27,Tuesday,3,150,
Gujarat,Surat,Mahuva,Bhindi,Other,FAQ,06-03-2024,1800,1900,1870,85,2024,3,6,Wednesday,1,100,
Gujarat,Surat,Mahuva,Bhindi,Other,FAQ,11-01-2024,2300,2400,2350,85,2024,1,11,Thursday,1,100,
Gujarat,Surat,Mahuva,Bhindi,Other,FAQ,17-12-2024,6100,6300,6200,85,2024,12,17,Tuesday,4,200,
Gujarat,Surat,Mahuva,Paddy(Dhan),Jaya,FAQ,07-06-2024,2200,2400,2300,2,2024,6,7,Friday,2,200,
Gujarat,Surat,Mahuva,Paddy(Dhan),Jaya,FAQ,12-06-2024,2300,2500,2400,2,2024,6,12,Wednesday,2,200,
Gujarat,Surat,Mahuva,Bhindi,Other,FAQ,07-08-2024,2300,2500,2450,85,2024,8,7,Wednesday,3,200,
Gujarat,Surat,Mahuva,Paddy(Dhan),Jaya,FAQ,18-06-2024,2300,2500,2400,2,2024,6,18,Tuesday,2,200,
Gujarat,Surat,Mahuva,Paddy(Dhan),Jaya,FAQ,20-06-2024,2200,2400,2300,2,2024,6,20,Thursday,2,200,
Gujarat,Surat,Mahuva,Bhindi,Other,FAQ,21-06-2024,3800,3900,3870,85,2024,6,21,Friday,2,100,
Gujarat,Surat,Mahuva,Paddy(Dhan),Jaya,FAQ,21-06-2024,2200,2400,2300,2,2024,6,21,Friday,2,200,
Gujarat,Surat,Mahuva,Paddy(Dhan),Jaya,FAQ,22-06-2024,2300,2500,2400,2,2024,6,22,Saturday,2,200,
Gujarat,Surat,Mahuva,Paddy(Dhan),Jaya,FAQ,13-11-2024,2100,2250,2200,2,2024,11,13,Wednesday,4,150,
Gujarat,Surat,Mahuva,Mango,Keshar,Medium,02-07-2024,9000,10000,9500,20,2024,7,2,Tuesday,3,1000,
Gujarat,Surat,Mahuva,Mango,Other,Medium,04-07-2024,2500,3000,2750,20,2024,7,4,Thursday,3,500,
Gujarat,Surat,Mahuva,Mango,Other,Medium,05-07-2024,2500,3000,2750,20,2024,7,5,Friday,3,500,
Gujarat,Surat,Mahuva,Mango,Other,Medium,08-07-2024,2000,2500,2250,20,2024,7,8,Monday,3,500,
Gujarat,Surat,Mahuva,Mango,Other,Medium,10-07-2024,1500,2000,1750,20,2024,7,10,Wednesday,3,500,
Gujarat,Surat,Mahuva,Mango,Other,Medium,11-07-2024,1500,2000,1750,20,2024,7,11,Thursday,3,500,
Gujarat,Surat,Mahuva,Mango,Raspuri,Medium,02-07-2024,3500,4500,4000,20,2024,7,2,Tuesday,3,1000,
Gujarat,Surat,Mahuva,Bhindi,Other,FAQ,02-07-2024,2800,2900,2850,85,2024,7,2,Tuesday,3,100,
Gujarat,Surat,Mahuva,Bhindi,Other,FAQ,03-07-2024,2000,2100,2070,85,2024,7,3,Wednesday,3,100,
Gujarat,Surat,Mahuva,Bhindi,Other,FAQ,13-07-2024,3800,3900,3850,85,2024,7,13,Saturday,3,100,
Gujarat,Surat,Mahuva,Bhindi,Other,FAQ,18-07-2024,3800,3900,3850,85,2024,7,18,Thursday,3,100,
Gujarat,Surat,Mahuva,Bhindi,Other,FAQ,22-07-2024,3600,3750,3700,85,2024,7,22,Monday,3,150,
Gujarat,Surat,Mahuva,Bhindi,Other,FAQ,29-07-2024,2400,2550,2500,85,2024,7,29,Monday,3,150,
Gujarat,Surat,Mahuva,Parval,Other,FAQ,16-07-2024,1800,1900,1870,303,2024,7,16,Tuesday,3,100,
Gujarat,Surat,Mahuva,Bhindi,Other,FAQ,02-08-2024,2300,2500,2400,85,2024,8,2,Friday,3,200,
Gujarat,Surat,Mahuva,Bhindi,Other,FAQ,09-08-2024,2400,2550,2500,85,2024,8,9,Friday,3,150,
Gujarat,Surat,Mahuva,Bhindi,Other,FAQ,21-08-2024,3500,3500,3500,85,2024,8,21,Wednesday,3,0,
Gujarat,Surat,Mahuva,Bhindi,Other,FAQ,23-08-2024,900,1000,950,85,2024,8,23,Friday,3,100,
Gujarat,Surat,Mahuva,Bhindi,Other,FAQ,27-08-2024,900,1100,1000,85,2024,8,27,Tuesday,3,200,
Gujarat,Surat,Mahuva,Parval,Other,FAQ,03-08-2024,2100,2250,2200,303,2024,8,3,Saturday,3,150,
Gujarat,Surat,Mahuva,Parval,Other,FAQ,05-08-2024,1800,2000,1950,303,2024,8,5,Monday,3,200,
Gujarat,Surat,Mahuva,Parval,Other,FAQ,07-08-2024,3000,3000,3000,303,2024,8,7,Wednesday,3,0,
Gujarat,Surat,Mahuva,Parval,Other,FAQ,08-08-2024,3400,3580,3500,303,2024,8,8,Thursday,3,180,
Gujarat,Surat,Mahuva,Parval,Other,FAQ,13-08-2024,3900,4000,3950,303,2024,8,13,Tuesday,3,100,
Gujarat,Surat,Mahuva,Parval,Other,FAQ,17-08-2024,4400,4600,4500,303,2024,8,17,Saturday,3,200,
Gujarat,Surat,Mahuva,Parval,Other,FAQ,23-08-2024,2400,2600,2500,303,2024,8,23,Friday,3,200,
Gujarat,Surat,Mahuva,Parval,Other,FAQ,28-08-2024,2500,2500,2500,303,2024,8,28,Wednesday,3,0,
Gujarat,Surat,Mahuva,Parval,Other,FAQ,31-08-2024,2900,3100,3000,303,2024,8,31,Saturday,3,200,
Gujarat,Surat,Mahuva,Mango,Keshar,Medium,04-06-2024,4000,6000,5000,20,2024,6,4,Tuesday,2,2000,
Gujarat,Surat,Mahuva,Mango,Other,Medium,11-06-2024,1500,2000,1750,20,2024,6,11,Tuesday,2,500,
Gujarat,Surat,Mahuva,Mango,Other,Medium,19-06-2024,2500,3000,2750,20,2024,6,19,Wednesday,2,500,
Gujarat,Surat,Mahuva,Mango,Other,Medium,27-06-2024,3000,3500,3250,20,2024,6,27,Thursday,2,500,
Gujarat,Surat,Mahuva,Mango,Raspuri,Medium,11-06-2024,2500,3000,2750,20,2024,6,11,Tuesday,2,500,
Gujarat,Surat,Mahuva,Mango,Totapuri,Medium,14-06-2024,3000,3000,3000,20,2024,6,14,Friday,2,0,
Gujarat,Surat,Mahuva,Mango,Totapuri,Medium,20-06-2024,4000,4000,4000,20,2024,6,20,Thursday,2,0,
Gujarat,Surat,Mahuva,Bhindi,Other,FAQ,02-05-2024,1000,1100,1050,85,2024,5,2,Thursday,2,100,
Gujarat,Surat,Mahuva,Bhindi,Other,FAQ,08-05-2024,800,900,850,85,2024,5,8,Wednesday,2,100,
Gujarat,Surat,Mahuva,Mango,Keshar,Medium,03-06-2024,4000,6000,5000,20,2024,6,3,Monday,2,2000,
Gujarat,Surat,Mahuva,Mango,Keshar,Medium,28-06-2024,9500,10000,9750,20,2024,6,28,Friday,2,500,
Gujarat,Surat,Mahuva,Mango,Other,Medium,03-06-2024,1000,1500,1250,20,2024,6,3,Monday,2,500,
Gujarat,Surat,Mahuva,Mango,Totapuri,Medium,13-06-2024,2500,2500,2500,20,2024,6,13,Thursday,2,0,
Gujarat,Surat,Mahuva,Parval,Other,FAQ,07-06-2024,3500,3600,3550,303,2024,6,7,Friday,2,100,
Gujarat,Surat,Mahuva,Parval,Other,FAQ,11-06-2024,2800,2900,2870,303,2024,6,11,Tuesday,2,100,
Gujarat,Surat,Mahuva,Parval,Other,FAQ,18-06-2024,3500,3600,3570,303,2024,6,18,Tuesday,2,100,
Gujarat,Surat,Mahuva,Parval,Other,FAQ,27-06-2024,3300,3400,3370,303,2024,6,27,Thursday,2,100,
Gujarat,Surat,Mahuva,Parval,Other,FAQ,28-06-2024,3300,3400,3350,303,2024,6,28,Friday,2,100,
Gujarat,Surat,Mahuva,Parval,Other,FAQ,29-06-2024,1800,1900,1870,303,2024,6,29,Saturday,2,100,
Gujarat,Surat,Mahuva,Parval,Other,FAQ,06-05-2024,3300,3400,3370,303,2024,5,6,Monday,2,100,
Gujarat,Surat,Mahuva,Parval,Other,FAQ,13-05-2024,1800,1900,1850,303,2024,5,13,Monday,2,100,
Gujarat,Surat,Mahuva,Parval,Other,FAQ,18-05-2024,1000,1100,1050,303,2024,5,18,Saturday,2,100,
Gujarat,Surat,Mahuva,Parval,Other,FAQ,22-05-2024,2500,2600,2550,303,2024,5,22,Wednesday,2,100,
Gujarat,Surat,Mahuva,Parval,Other,FAQ,23-05-2024,2400,2700,2600,303,2024,5,23,Thursday,2,300,
Gujarat,Surat,Mahuva,Mango,Other,Medium,29-05-2024,1250,2000,1500,20,2024,5,29,Wednesday,2,750,
Gujarat,Surat,Mahuva,Mango,Totapuri,Medium,30-05-2024,1750,2250,2000,20,2024,5,30,Thursday,2,500,
Gujarat,Surat,Mahuva,Mango,Keshar,Medium,23-05-2024,6000,7500,6500,20,2024,5,23,Thursday,2,1500,
Gujarat,Surat,Mahuva,Mango,Keshar,Medium,30-05-2024,5000,7000,6000,20,2024,5,30,Thursday,2,2000,
Gujarat,Surat,Mahuva,Mango,Raspuri,Medium,23-05-2024,2500,3500,3000,20,2024,5,23,Thursday,2,1000,
Gujarat,Surat,Mahuva,Bhindi,Other,FAQ,03-01-2024,2800,2900,2850,85,2024,1,3,Wednesday,1,100,
Gujarat,Surat,Mahuva,Bhindi,Other,FAQ,24-01-2024,2800,2900,2850,85,2024,1,24,Wednesday,1,100,
Gujarat,Surat,Mahuva,Bhindi,Other,FAQ,22-02-2024,2000,2100,2070,85,2024,2,22,Thursday,1,100,
Gujarat,Surat,Mahuva,Bhindi,Other,FAQ,28-02-2024,2500,2600,2550,85,2024,2,28,Wednesday,1,100,
Gujarat,Surat,Mahuva,Bhindi,Other,FAQ,03-04-2024,1500,1600,1550,85,2024,4,3,Wednesday,2,100,
Gujarat,Surat,Mahuva,Bhindi,Other,FAQ,11-01-2024,2300,2400,2350,85,2024,1,11,Thursday,1,100,
Gujarat,Surat,Mahuva,Bhindi,Other,FAQ,27-03-2024,1300,1400,1370,85,2024,3,27,Wednesday,1,100,
Gujarat,Surat,Mahuva,Bhindi,Other,FAQ,15-04-2024,1800,1900,1870,85,2024,4,15,Monday,2,100,
Gujarat,Surat,Mahuva,Bhindi,Other,FAQ,19-04-2024,2500,2600,2570,85,2024,4,19,Friday,2,100,
Gujarat,Surat,Mahuva,Bhindi,Other,FAQ,01-01-2024,2800,2900,2870,85,2024,1,1,Monday,1,100,
Gujarat,Surat,Mahuva,Bhindi,Other,FAQ,06-01-2024,2800,2900,2850,85,2024,1,6,Saturday,1,100,
Gujarat,Surat,Mahuva,Bhindi,Other,FAQ,10-02-2024,2000,2100,2050,85,2024,2,10,Saturday,1,100,
Gujarat,Surat,Mahuva,Bhindi,Other,FAQ,12-02-2024,2300,2400,2370,85,2024,2,12,Monday,1,100,
Gujarat,Surat,Mahuva,Bhindi,Other,FAQ,26-02-2024,3300,3400,3350,85,2024,2,26,Monday,1,100,
Gujarat,Surat,Mahuva,Bhindi,Other,FAQ,06-03-2024,1800,1900,1870,85,2024,3,6,Wednesday,1,100,
Gujarat,Surat,Mahuva,Bhindi,Other,FAQ,01-04-2024,1500,1600,1550,85,2024,4,1,Monday,2,100,
Gujarat,Surat,Mahuva,Bhindi,Other,FAQ,18-04-2024,2300,2400,2370,85,2024,4,18,Thursday,2,100,
Gujarat,Surat,Mahuva,Bhindi,Other,FAQ,25-04-2024,2300,2400,2350,85,2024,4,25,Thursday,2,100,
Gujarat,Surat,Mahuva,Parval,Other,FAQ,22-01-2024,4800,4900,4850,303,2024,1,22,Monday,1,100,
Gujarat,Surat,Mahuva,Parval,Other,FAQ,27-01-2024,6000,6100,6070,303,2024,1,27,Saturday,1,100,
Gujarat,Surat,Mahuva,Parval,Other,FAQ,02-02-2024,6000,6100,6050,303,2024,2,2,Friday,1,100,
Gujarat,Surat,Mahuva,Parval,Other,FAQ,10-02-2024,7900,8000,7950,303,2024,2,10,Saturday,1,100,
Gujarat,Surat,Mahuva,Parval,Other,FAQ,14-02-2024,6800,6900,6870,303,2024,2,14,Wednesday,1,100,
Gujarat,Surat,Mahuva,Parval,Other,FAQ,17-02-2024,7500,7600,7550,303,2024,2,17,Saturday,1,100,
Gujarat,Surat,Mahuva,Parval,Other,FAQ,22-02-2024,6300,6400,6370,303,2024,2,22,Thursday,1,100,
Gujarat,Surat,Mahuva,Parval,Other,FAQ,28-02-2024,6000,6100,6050,303,2024,2,28,Wednesday,1,100,
Gujarat,Surat,Mahuva,Parval,Other,FAQ,29-02-2024,5800,5900,5870,303,2024,2,29,Thursday,1,100,
Gujarat,Surat,Mahuva,Parval,Other,FAQ,02-03-2024,5300,5400,5350,303,2024,3,2,Saturday,1,100,
Gujarat,Surat,Mahuva,Parval,Other,FAQ,12-03-2024,4300,4400,4370,303,2024,3,12,Tuesday,1,100,
Gujarat,Surat,Mahuva,Parval,Other,FAQ,16-03-2024,4500,4600,4550,303,2024,3,16,Saturday,1,100,
Gujarat,Surat,Mahuva,Parval,Other,FAQ,19-03-2024,4800,4900,4870,303,2024,3,19,Tuesday,1,100,
Gujarat,Surat,Mahuva,Parval,Other,FAQ,26-03-2024,3300,3400,3350,303,2024,3,26,Tuesday,1,100,
Gujarat,Surat,Mahuva,Parval,Other,FAQ,27-03-2024,3500,3600,3570,303,2024,3,27,Wednesday,1,100,
Gujarat,Surat,Mahuva,Parval,Other,FAQ,20-04-2024,3000,3100,3050,303,2024,4,20,Saturday,2,100,
Gujarat,Surat,Mahuva,Parval,Other,FAQ,01-01-2025,5300,5500,5400,303,2025,1,1,Wednesday,1,200,
Gujarat,Surat,Mahuva,Parval,Other,FAQ,03-09-2024,3400,3600,3500,303,2024,9,3,Tuesday,3,200,
Gujarat,Surat,Mahuva,Parval,Other,FAQ,19-09-2024,3800,4000,3900,303,2024,9,19,Thursday,3,200,
Gujarat,Surat,Mahuva,Parval,Other,FAQ,21-09-2024,3400,3600,3500,303,2024,9,21,Saturday,3,200,
Gujarat,Surat,Mahuva,Parval,Other,FAQ,24-09-2024,2400,2600,2500,303,2024,9,24,Tuesday,3,200,
Gujarat,Surat,Mahuva,Parval,Other,FAQ,27-09-2024,2100,2250,2200,303,2024,9,27,Friday,3,150,
Gujarat,Surat,Mahuva,Bhindi,Other,FAQ,13-09-2024,3400,3600,3500,85,2024,9,13,Friday,3,200,
Gujarat,Surat,Mahuva,Bhindi,Other,FAQ,10-06-2024,3000,3100,3050,85,2024,6,10,Monday,2,100,
Gujarat,Surat,Mahuva,Bhindi,Other,FAQ,20-06-2024,3800,3900,3870,85,2024,6,20,Thursday,2,100,
Gujarat,Surat,Mahuva,Parval,Other,FAQ,20-11-2024,3100,3300,3200,303,2024,11,20,Wednesday,4,200,
Gujarat,Surat,Mahuva,Parval,Other,FAQ,27-11-2024,3000,3150,3100,303,2024,11,27,Wednesday,4,150,
Gujarat,Surat,Mahuva,Bhindi,Other,FAQ,22-11-2024,3400,3550,3500,85,2024,11,22,Friday,4,150,
Gujarat,Surat,Mahuva,Parval,Other,FAQ,04-12-2024,3500,3700,3600,303,2024,12,4,Wednesday,4,200,
Gujarat,Surat,Mahuva,Parval,Other,FAQ,06-12-2024,3400,3550,3500,303,2024,12,6,Friday,4,150,
Gujarat,Surat,Mahuva,Parval,Other,FAQ,23-12-2024,5400,5550,5500,303,2024,12,23,Monday,4,150,
Gujarat,Surat,Mahuva,Bhindi,Other,FAQ,05-12-2024,4400,4550,4500,85,2024,12,5,Thursday,4,150,
Gujarat,Surat,Mahuva,Bhindi,Other,FAQ,16-12-2024,5400,5600,5500,85,2024,12,16,Monday,4,200,
Gujarat,Surat,Mahuva,Parval,Other,FAQ,24-10-2024,3400,3550,3500,303,2024,10,24,Thursday,4,150,
Gujarat,Surat,Mahuva,Bhindi,Other,FAQ,08-10-2024,2800,3000,2900,85,2024,10,8,Tuesday,4,200,
Gujarat,Surat,Mahuva,Parval,Other,FAQ,11-10-2024,4800,5000,4900,303,2024,10,11,Friday,4,200,
Gujarat,Surat,Mahuva,Parval,Other,FAQ,15-10-2024,4800,5000,4900,303,2024,10,15,Tuesday,4,200,
Gujarat,Surat,Mahuva,Parval,Other,FAQ,27-10-2024,3900,4100,4000,303,2024,10,27,Sunday,4,200,
Gujarat,Surat,Mahuva,Parval,Other,FAQ,23-10-2024,3400,3600,3500,303,2024,10,23,Wednesday,4,200,
Gujarat,Surat,Mahuva,Parval,Other,FAQ,21-10-2024,3800,4000,3900,303,2024,10,21,Monday,4,200,
Gujarat,Surat,Mahuva,Parval,Other,FAQ,14-11-2024,2100,2250,2200,303,2024,11,14,Thursday,4,150,
Gujarat,Surat,Mahuva,Parval,Other,FAQ,23-11-2024,2400,2550,2500,303,2024,11,23,Saturday,4,150,
Gujarat,Surat,Mahuva,Bhindi,Other,FAQ,27-11-2024,3400,3600,3500,85,2024,11,27,Wednesday,4,200,
Gujarat,Surat,Mahuva,Parval,Other,FAQ,14-09-2024,4400,4600,4500,303,2024,9,14,Saturday,3,200,
Gujarat,Surat,Mahuva,Parval,Other,FAQ,23-09-2024,3400,3600,3500,303,2024,9,23,Monday,3,200,
Gujarat,Surat,Mahuva,Bhindi,Other,FAQ,09-09-2024,1900,2100,2000,85,2024,9,9,Monday,3,200,
Gujarat,Surat,Mahuva,Bhindi,Other,FAQ,12-09-2024,3400,3600,3500,85,2024,9,12,Thursday,3,200,
Gujarat,Surat,Mahuva,Bhindi,Other,FAQ,01-01-2025,4400,4600,4500,85,2025,1,1,Wednesday,1,200,
Gujarat,Surat,Mahuva,Parval,Other,FAQ,08-12-2024,3500,3700,3600,303,2024,12,8,Sunday,4,200,
Gujarat,Surat,Mahuva,Parval,Other,FAQ,13-12-2024,3400,3600,3550,303,2024,12,13,Friday,4,200,
Gujarat,Surat,Mahuva,Parval,Other,FAQ,27-12-2024,5000,5200,5150,303,2024,12,27,Friday,4,200,
Gujarat,Surat,Mahuva,Parval,Other,FAQ,31-12-2024,4800,5000,4900,303,2024,12,31,Tuesday,4,200,
Gujarat,Surat,Mahuva,Parval,Other,FAQ,09-08-2024,3400,3550,3500,303,2024,8,9,Friday,3,150,
Gujarat,Surat,Mahuva,Parval,Other,FAQ,27-08-2024,2400,2600,2500,303,2024,8,27,Tuesday,3,200,
Gujarat,Surat,Mahuva,Bhindi,Other,FAQ,07-08-2024,2400,2550,2500,85,2024,8,7,Wednesday,3,150,
Gujarat,Surat,Mahuva,Bhindi,Other,FAQ,08-08-2024,2400,2580,2500,85,2024,8,8,Thursday,3,180,
Gujarat,Surat,Mahuva,Bhindi,Other,FAQ,11-08-2024,2550,2550,2550,85,2024,8,11,Sunday,3,0,
Gujarat,Surat,Mahuva,Bhindi,Other,FAQ,16-08-2024,2800,3000,2900,85,2024,8,16,Friday,3,200,
Gujarat,Surat,Mahuva,Bhindi,Other,FAQ,22-08-2024,900,1050,1000,85,2024,8,22,Thursday,3,150,
Gujarat,Surat,Mahuva,Bhindi,Other,FAQ,24-08-2024,1000,1150,1100,85,2024,8,24,Saturday,3,150,
Gujarat,Surat,Mahuva,Bhindi,Other,FAQ,29-08-2024,1400,1500,1450,85,2024,8,29,Thursday,3,100,
Gujarat,Surat,Mahuva,Bhindi,Other,FAQ,02-12-2024,4400,4600,4500,85,2024,12,2,Monday,4,200,
Gujarat,Surat,Mahuva,Bhindi,Other,FAQ,17-12-2024,6100,6300,6200,85,2024,12,17,Tuesday,4,200,
Gujarat,Surat,Mahuva,Bhindi,Other,FAQ,23-12-2024,5900,6100,6000,85,2024,12,23,Monday,4,200,
Gujarat,Surat,Mahuva,Bhindi,Other,FAQ,18-01-2024,3300,3400,3370,85,2024,1,18,Thursday,1,100,
Gujarat,Surat,Mahuva,Bhindi,Other,FAQ,23-01-2024,3000,3900,3070,85,2024,1,23,Tuesday,1,900,
Gujarat,Surat,Mahuva,Bhindi,Other,FAQ,15-02-2024,2800,2900,2850,85,2024,2,15,Thursday,1,100,
Gujarat,Surat,Mahuva,Bhindi,Other,FAQ,27-02-2024,3300,3400,3370,85,2024,2,27,Tuesday,1,100,
Gujarat,Surat,Mahuva,Bhindi,Other,FAQ,20-03-2024,2500,2600,2570,85,2024,3,20,Wednesday,1,100,
Gujarat,Surat,Mahuva,Bhindi,Other,FAQ,23-03-2024,1800,1900,1870,85,2024,3,23,Saturday,1,100,
Gujarat,Surat,Mahuva,Bhindi,Other,FAQ,24-04-2024,2300,2400,2370,85,2024,4,24,Wednesday,2,100,
Gujarat,Surat,Mahuva,Parval,Other,FAQ,04-01-2024,4200,4300,4270,303,2024,1,4,Thursday,1,100,
Gujarat,Surat,Mahuva,Parval,Other,FAQ,05-01-2024,4300,4400,4350,303,2024,1,5,Friday,1,100,
Gujarat,Surat,Mahuva,Parval,Other,FAQ,11-01-2024,3300,3400,3350,303,2024,1,11,Thursday,1,100,
Gujarat,Surat,Mahuva,Parval,Other,FAQ,16-01-2024,3800,3900,3870,303,2024,1,16,Tuesday,1,100,
Gujarat,Surat,Mahuva,Parval,Other,FAQ,25-01-2024,5500,5600,5570,303,2024,1,25,Thursday,1,100,
Gujarat,Surat,Mahuva,Parval,Other,FAQ,05-02-2024,6800,6900,6850,303,2024,2,5,Monday,1,100,
Gujarat,Surat,Mahuva,Parval,Other,FAQ,19-02-2024,7800,7900,7850,303,2024,2,19,Monday,1,100,
Gujarat,Surat,Mahuva,Parval,Other,FAQ,21-02-2024,6800,6900,6850,303,2024,2,21,Wednesday,1,100,
Gujarat,Surat,Mahuva,Parval,Other,FAQ,01-03-2024,5800,5900,5870,303,2024,3,1,Friday,1,100,
Gujarat,Surat,Mahuva,Parval,Other,FAQ,06-03-2024,5300,5400,5370,303,2024,3,6,Wednesday,1,100,
Gujarat,Surat,Mahuva,Parval,Other,FAQ,09-03-2024,4300,4400,4370,303,2024,3,9,Saturday,1,100,
Gujarat,Surat,Mahuva,Parval,Other,FAQ,14-03-2024,4800,4900,4870,303,2024,3,14,Thursday,1,100,
Gujarat,Surat,Mahuva,Parval,Other,FAQ,20-03-2024,4300,4400,4370,303,2024,3,20,Wednesday,1,100,
Gujarat,Surat,Mahuva,Parval,Other,FAQ,04-04-2024,2500,2600,2570,303,2024,4,4,Thursday,2,100,
Gujarat,Surat,Mahuva,Parval,Other,FAQ,09-04-2024,3500,3600,3570,303,2024,4,9,Tuesday,2,100,
Gujarat,Surat,Mahuva,Parval,Other,FAQ,19-04-2024,3500,3600,3570,303,2024,4,19,Friday,2,100,
Gujarat,Surat,Mahuva,Mango,Keshar,Medium,06-06-2024,4000,6000,5000,20,2024,6,6,Thursday,2,2000,
Gujarat,Surat,Mahuva,Mango,Keshar,Medium,07-06-2024,4000,6000,5500,20,2024,6,7,Friday,2,2000,
Gujarat,Surat,Mahuva,Mango,Keshar,Medium,21-06-2024,6000,8000,7000,20,2024,6,21,Friday,2,2000,
Gujarat,Surat,Mahuva,Mango,Keshar,Medium,26-06-2024,9500,10000,9750,20,2024,6,26,Wednesday,2,500,
Gujarat,Surat,Mahuva,Mango,Other,Medium,05-06-2024,1000,1500,1250,20,2024,6,5,Wednesday,2,500,
Gujarat,Surat,Mahuva,Mango,Other,Medium,07-06-2024,1500,2000,1750,20,2024,6,7,Friday,2,500,
Gujarat,Surat,Mahuva,Mango,Other,Medium,14-06-2024,1500,2250,2000,20,2024,6,14,Friday,2,750,
Gujarat,Surat,Mahuva,Mango,Other,Medium,15-06-2024,1500,2500,2000,20,2024,6,15,Saturday,2,1000,
Gujarat,Surat,Mahuva,Mango,Other,Medium,24-06-2024,2500,3000,2750,20,2024,6,24,Monday,2,500,
Gujarat,Surat,Mahuva,Mango,Raspuri,Medium,07-06-2024,2500,3000,2750,20,2024,6,7,Friday,2,500,
Gujarat,Surat,Mahuva,Mango,Raspuri,Medium,15-06-2024,3000,4000,3500,20,2024,6,15,Saturday,2,1000,
Gujarat,Surat,Mahuva,Mango,Raspuri,Medium,19-06-2024,4000,4500,4250,20,2024,6,19,Wednesday,2,500,
Gujarat,Surat,Mahuva,Mango,Raspuri,Medium,22-06-2024,4000,4500,4250,20,2024,6,22,Saturday,2,500,
Gujarat,Surat,Mahuva,Mango,Raspuri,Medium,29-06-2024,4000,4500,4250,20,2024,6,29,Saturday,2,500,
Gujarat,Surat,Mahuva,Mango,Totapuri,Medium,04-06-2024,2000,2000,2000,20,2024,6,4,Tuesday,2,0,
Gujarat,Surat,Mahuva,Mango,Totapuri,Medium,11-06-2024,2500,2500,2500,20,2024,6,11,Tuesday,2,0,
Gujarat,Surat,Mahuva,Mango,Totapuri,Medium,21-06-2024,3500,3500,3500,20,2024,6,21,Friday,2,0,
Gujarat,Surat,Mahuva,Mango,Totapuri,Medium,22-06-2024,3000,3000,3000,20,2024,6,22,Saturday,2,0,
Gujarat,Surat,Mahuva,Mango,Totapuri,Medium,25-06-2024,3000,3000,3000,20,2024,6,25,Tuesday,2,0,
Gujarat,Surat,Mahuva,Bhindi,Other,FAQ,06-05-2024,1000,1100,1070,85,2024,5,6,Monday,2,100,
Gujarat,Surat,Mahuva,Bhindi,Other,FAQ,09-05-2024,1300,1400,1370,85,2024,5,9,Thursday,2,100,
Gujarat,Surat,Mahuva,Bhindi,Other,FAQ,16-05-2024,800,900,850,85,2024,5,16,Thursday,2,100,
Gujarat,Surat,Mahuva,Bhindi,Other,FAQ,24-05-2024,1300,1400,1350,85,2024,5,24,Friday,2,100,
Gujarat,Surat,Mahuva,Bhindi,Other,FAQ,30-05-2024,2300,2400,2350,85,2024,5,30,Thursday,2,100,
Gujarat,Surat,Mahuva,Bhindi,Other,FAQ,03-06-2024,2300,2400,2350,85,2024,6,3,Monday,2,100,
Gujarat,Surat,Mahuva,Bhindi,Other,FAQ,22-06-2024,3300,3400,3350,85,2024,6,22,Saturday,2,100,
Gujarat,Surat,Mahuva,Bhindi,Other,FAQ,24-06-2024,3800,3900,3850,85,2024,6,24,Monday,2,100,
Gujarat,Surat,Mahuva,Bhindi,Other,FAQ,29-06-2024,2800,2900,2870,85,2024,6,29,Saturday,2,100,
Gujarat,Surat,Mahuva,Mango,Other,Medium,23-05-2024,2250,3250,2500,20,2024,5,23,Thursday,2,1000,
Gujarat,Surat,Mahuva,Mango,Raspuri,Medium,29-05-2024,3000,3000,3000,20,2024,5,29,Wednesday,2,0,
Gujarat,Surat,Mahuva,Mango,Totapuri,Medium,29-05-2024,2500,2500,2500,20,2024,5,29,Wednesday,2,0,
Gujarat,Surat,Mahuva,Bhindi,Other,FAQ,17-01-2024,2800,2900,2850,85,2024,1,17,Wednesday,1,100,
Gujarat,Surat,Mahuva,Bhindi,Other,FAQ,01-02-2024,3300,3400,3370,85,2024,2,1,Thursday,1,100,
Gujarat,Surat,Mahuva,Bhindi,Other,FAQ,17-02-2024,2800,2900,2850,85,2024,2,17,Saturday,1,100,
Gujarat,Surat,Mahuva,Bhindi,Other,FAQ,29-02-2024,2800,2900,2870,85,2024,2,29,Thursday,1,100,
Gujarat,Surat,Mahuva,Bhindi,Other,FAQ,22-03-2024,1800,1900,1850,85,2024,3,22,Friday,1,100,
Gujarat,Surat,Mahuva,Bhindi,Other,FAQ,12-04-2024,1800,1900,1850,85,2024,4,12,Friday,2,100,
Gujarat,Surat,Mahuva,Bhindi,Other,FAQ,16-01-2024,1800,1900,1870,85,2024,1,16,Tuesday,1,100,
Gujarat,Surat,Mahuva,Bhindi,Other,FAQ,07-02-2024,2000,2100,2050,85,2024,2,7,Wednesday,1,100,
Gujarat,Surat,Mahuva,Bhindi,Other,FAQ,27-04-2024,1300,1400,1370,85,2024,4,27,Saturday,2,100,
Gujarat,Surat,Mahuva,Parval,Other,FAQ,01-05-2024,3000,3100,3070,303,2024,5,1,Wednesday,2,100,
Gujarat,Surat,Mahuva,Parval,Other,FAQ,03-05-2024,3000,3100,3050,303,2024,5,3,Friday,2,100,
Gujarat,Surat,Mahuva,Parval,Other,FAQ,14-05-2024,1500,1600,1550,303,2024,5,14,Tuesday,2,100,
Gujarat,Surat,Mahuva,Parval,Other,FAQ,21-05-2024,1800,1900,1870,303,2024,5,21,Tuesday,2,100,
Gujarat,Surat,Mahuva,Parval,Other,FAQ,28-05-2024,3400,3500,3450,303,2024,5,28,Tuesday,2,100,
Gujarat,Surat,Mahuva,Parval,Other,FAQ,19-07-2024,1500,1600,1550,303,2024,7,19,Friday,3,100,
Gujarat,Surat,Mahuva,Parval,Other,FAQ,22-07-2024,1300,1450,1400,303,2024,7,22,Monday,3,150,
Gujarat,Surat,Mahuva,Parval,Other,FAQ,31-07-2024,1900,2080,2000,303,2024,7,31,Wednesday,3,180,
Gujarat,Surat,Mahuva,Mango,Keshar,Medium,05-07-2024,9000,9500,9250,20,2024,7,5,Friday,3,500,
Gujarat,Surat,Mahuva,Mango,Other,Medium,03-07-2024,2500,3000,2750,20,2024,7,3,Wednesday,3,500,
Gujarat,Surat,Mahuva,Mango,Other,Medium,12-07-2024,1500,2000,1750,20,2024,7,12,Friday,3,500,
Gujarat,Surat,Mahuva,Mango,Raspuri,Medium,03-07-2024,2500,3000,2750,20,2024,7,3,Wednesday,3,500,
Gujarat,Surat,Mahuva,Bhindi,Other,FAQ,09-07-2024,1800,1900,1850,85,2024,7,9,Tuesday,3,100,
Gujarat,Surat,Mahuva,Bhindi,Other,FAQ,12-07-2024,4700,4800,4770,85,2024,7,12,Friday,3,100,
Gujarat,Surat,Mahuva,Bhindi,Other,FAQ,23-07-2024,3800,3950,3900,85,2024,7,23,Tuesday,3,150,
Gujarat,Surat,Mahuva,Bhindi,Other,FAQ,27-07-2024,2200,2380,2300,85,2024,7,27,Saturday,3,180,
Gujarat,Surat,Mahuva,Bhindi,Other,FAQ,31-07-2024,3700,3880,3800,85,2024,7,31,Wednesday,3,180,
Gujarat,Surat,Mahuva,Parval,Other,FAQ,01-06-2024,3300,3400,3350,303,2024,6,1,Saturday,2,100,
Gujarat,Surat,Mahuva,Parval,Other,FAQ,13-06-2024,2800,2900,2870,303,2024,6,13,Thursday,2,100,
Gujarat,Surat,Mahuva,Parval,Other,FAQ,14-06-2024,2800,2900,2850,303,2024,6,14,Friday,2,100,
Gujarat,Surat,Mahuva,Parval,Other,FAQ,20-06-2024,2800,2900,2870,303,2024,6,20,Thursday,2,100,
Gujarat,Surat,Mahuva,Parval,Other,FAQ,24-06-2024,3500,3600,3550,303,2024,6,24,Monday,2,100,
Gujarat,Surat,Mahuva,Parval,Other,FAQ,26-10-2024,3400,3600,3500,303,2024,10,26,Saturday,4,200,
Gujarat,Surat,Mahuva,Parval,Other,FAQ,16-10-2024,4400,4500,4450,303,2024,10,16,Wednesday,4,100,
Gujarat,Surat,Mahuva,Parval,Other,FAQ,22-10-2024,3900,4100,4000,303,2024,10,22,Tuesday,4,200,
Gujarat,Surat,Mahuva,Parval,Other,FAQ,14-10-2024,4900,5100,5000,303,2024,10,14,Monday,4,200,
Gujarat,Surat,Mahuva,Parval,Other,FAQ,03-10-2024,2800,3000,2900,303,2024,10,3,Thursday,4,200,
Gujarat,Surat,Mahuva,Bhindi,Other,FAQ,04-05-2024,1000,1100,1050,85,2024,5,4,Saturday,2,100,
Gujarat,Surat,Mahuva,Bhindi,Other,FAQ,14-05-2024,800,900,850,85,2024,5,14,Tuesday,2,100,
Gujarat,Surat,Mahuva,Bhindi,Other,FAQ,15-05-2024,1000,1100,1070,85,2024,5,15,Wednesday,2,100,
Gujarat,Surat,Mahuva,Bhindi,Other,FAQ,17-05-2024,800,900,870,85,2024,5,17,Friday,2,100,
Gujarat,Surat,Mahuva,Bhindi,Other,FAQ,18-05-2024,800,900,850,85,2024,5,18,Saturday,2,100,
Gujarat,Surat,Mahuva,Bhindi,Other,FAQ,25-05-2024,1300,1400,1370,85,2024,5,25,Saturday,2,100,
Gujarat,Surat,Mahuva,Bhindi,Other,FAQ,27-05-2024,1800,1900,1850,85,2024,5,27,Monday,2,100,
Gujarat,Surat,Mahuva,Parval,Other,FAQ,17-01-2024,4800,4900,4850,303,2024,1,17,Wednesday,1,100,
Gujarat,Surat,Mahuva,Parval,Other,FAQ,19-01-2024,5200,5300,5250,303,2024,1,19,Friday,1,100,
Gujarat,Surat,Mahuva,Parval,Other,FAQ,23-01-2024,5500,5600,5570,303,2024,1,23,Tuesday,1,100,
Gujarat,Surat,Mahuva,Parval,Other,FAQ,31-01-2024,6200,6300,6250,303,2024,1,31,Wednesday,1,100,
Gujarat,Surat,Mahuva,Parval,Other,FAQ,08-02-2024,7900,8000,7950,303,2024,2,8,Thursday,1,100,
Gujarat,Surat,Mahuva,Parval,Other,FAQ,13-02-2024,6300,6400,6350,303,2024,2,13,Tuesday,1,100,
Gujarat,Surat,Mahuva,Parval,Other,FAQ,16-02-2024,7300,7400,7370,303,2024,2,16,Friday,1,100,
Gujarat,Surat,Mahuva,Parval,Other,FAQ,20-02-2024,7800,7900,7870,303,2024,2,20,Tuesday,1,100,
Gujarat,Surat,Mahuva,Parval,Other,FAQ,04-03-2024,5800,5900,5850,303,2024,3,4,Monday,1,100,
Gujarat,Surat,Mahuva,Parval,Other,FAQ,30-03-2024,2300,2400,2370,303,2024,3,30,Saturday,1,100,
Gujarat,Surat,Mahuva,Parval,Other,FAQ,02-04-2024,2000,2100,2070,303,2024,4,2,Tuesday,2,100,
Gujarat,Surat,Mahuva,Parval,Other,FAQ,08-04-2024,3300,3400,3350,303,2024,4,8,Monday,2,100,
Gujarat,Surat,Mahuva,Parval,Other,FAQ,17-04-2024,2900,3000,2950,303,2024,4,17,Wednesday,2,100,
Gujarat,Surat,Mahuva,Parval,Other,FAQ,24-04-2024,3500,3600,3570,303,2024,4,24,Wednesday,2,100,
Gujarat,Surat,Mahuva,Mango,Keshar,Medium,29-05-2024,5000,7000,6000,20,2024,5,29,Wednesday,2,2000,
Gujarat,Surat,Mahuva,Bhindi,Other,FAQ,01-06-2024,2500,2600,2550,85,2024,6,1,Saturday,2,100,
Gujarat,Surat,Mahuva,Bhindi,Other,FAQ,08-06-2024,2800,2900,2870,85,2024,6,8,Saturday,2,100,
Gujarat,Surat,Mahuva,Bhindi,Other,FAQ,13-06-2024,3500,3600,3570,85,2024,6,13,Thursday,2,100,
Gujarat,Surat,Mahuva,Bhindi,Other,FAQ,15-06-2024,3500,3600,3550,85,2024,6,15,Saturday,2,100,
Gujarat,Surat,Mahuva,Bhindi,Other,FAQ,19-06-2024,3800,3900,3850,85,2024,6,19,Wednesday,2,100,
Gujarat,Surat,Mahuva,Bhindi,Other,FAQ,25-06-2024,3300,3400,3370,85,2024,6,25,Tuesday,2,100,
Gujarat,Surat,Mahuva,Parval,Other,FAQ,10-05-2024,2800,2900,2850,303,2024,5,10,Friday,2,100,
Gujarat,Surat,Mahuva,Parval,Other,FAQ,24-05-2024,3300,3400,3350,303,2024,5,24,Friday,2,100,
Gujarat,Surat,Mahuva,Parval,Other,FAQ,30-05-2024,2800,2900,2850,303,2024,5,30,Thursday,2,100,
Gujarat,Surat,Mahuva,Mango,Keshar,Medium,05-06-2024,4000,6000,5000,20,2024,6,5,Wednesday,2,2000,
Gujarat,Surat,Mahuva,Mango,Keshar,Medium,08-06-2024,4000,5500,5000,20,2024,6,8,Saturday,2,1500,
Gujarat,Surat,Mahuva,Mango,Keshar,Medium,14-06-2024,4000,5500,5000,20,2024,6,14,Friday,2,1500,
Gujarat,Surat,Mahuva,Mango,Keshar,Medium,22-06-2024,7500,8500,8000,20,2024,6,22,Saturday,2,1000,
Gujarat,Surat,Mahuva,Mango,Other,Medium,10-06-2024,1000,2000,1500,20,2024,6,10,Monday,2,1000,
Gujarat,Surat,Mahuva,Mango,Other,Medium,18-06-2024,2000,2750,2500,20,2024,6,18,Tuesday,2,750,
Gujarat,Surat,Mahuva,Mango,Other,Medium,21-06-2024,3000,3500,3250,20,2024,6,21,Friday,2,500,
Gujarat,Surat,Mahuva,Mango,Other,Medium,26-06-2024,2500,3000,2750,20,2024,6,26,Wednesday,2,500,
Gujarat,Surat,Mahuva,Mango,Other,Medium,29-06-2024,2500,3000,2750,20,2024,6,29,Saturday,2,500,
Gujarat,Surat,Mahuva,Mango,Raspuri,Medium,08-06-2024,2500,3000,2750,20,2024,6,8,Saturday,2,500,
Gujarat,Surat,Mahuva,Mango,Raspuri,Medium,13-06-2024,3000,3500,3250,20,2024,6,13,Thursday,2,500,
Gujarat,Surat,Mahuva,Mango,Raspuri,Medium,18-06-2024,4000,4500,4250,20,2024,6,18,Tuesday,2,500,
Gujarat,Surat,Mahuva,Mango,Raspuri,Medium,27-06-2024,4500,5000,4750,20,2024,6,27,Thursday,2,500,
Gujarat,Surat,Mahuva,Mango,Totapuri,Medium,06-06-2024,2250,2250,2250,20,2024,6,6,Thursday,2,0,
Gujarat,Surat,Mahuva,Mango,Totapuri,Medium,12-06-2024,2500,2500,2500,20,2024,6,12,Wednesday,2,0,
Gujarat,Surat,Mahuva,Mango,Totapuri,Medium,15-06-2024,3250,3250,3250,20,2024,6,15,Saturday,2,0,
Gujarat,Surat,Mahuva,Mango,Totapuri,Medium,18-06-2024,3000,3000,3000,20,2024,6,18,Tuesday,2,0,
Gujarat,Surat,Mahuva,Mango,Totapuri,Medium,26-06-2024,3000,3000,3000,20,2024,6,26,Wednesday,2,0,
Gujarat,Surat,Mahuva,Parval,Other,FAQ,03-06-2024,3300,3400,3350,303,2024,6,3,Monday,2,100,
Gujarat,Surat,Mahuva,Parval,Other,FAQ,04-06-2024,2800,2900,2870,303,2024,6,4,Tuesday,2,100,
Gujarat,Surat,Mahuva,Parval,Other,FAQ,06-06-2024,3500,3600,3570,303,2024,6,6,Thursday,2,100,
Gujarat,Surat,Mahuva,Parval,Other,FAQ,08-06-2024,2500,2600,2570,303,2024,6,8,Saturday,2,100,
Gujarat,Surat,Mahuva,Mango,Keshar,Medium,03-07-2024,8500,9500,9000,20,2024,7,3,Wednesday,3,1000,
Gujarat,Surat,Mahuva,Mango,Other,Medium,02-07-2024,2500,3000,2750,20,2024,7,2,Tuesday,3,500,
Gujarat,Surat,Mahuva,Mango,Other,Medium,16-07-2024,1250,1750,1500,20,2024,7,16,Tuesday,3,500,
Gujarat,Surat,Mahuva,Mango,Raspuri,Medium,05-07-2024,3000,3500,3250,20,2024,7,5,Friday,3,500,
Gujarat,Surat,Mahuva,Bhindi,Other,FAQ,01-07-2024,2800,2900,2870,85,2024,7,1,Monday,3,100,
Gujarat,Surat,Mahuva,Bhindi,Other,FAQ,19-07-2024,4000,4200,4100,85,2024,7,19,Friday,3,200,
Gujarat,Surat,Mahuva,Bhindi,Other,FAQ,25-07-2024,3400,3570,3500,85,2024,7,25,Thursday,3,170,
Gujarat,Surat,Mahuva,Bhindi,Other,FAQ,05-07-2024,3000,3100,3050,85,2024,7,5,Friday,3,100,
Gujarat,Surat,Mahuva,Bhindi,Other,FAQ,16-07-2024,3800,3900,3870,85,2024,7,16,Tuesday,3,100,
Gujarat,Surat,Mahuva,Parval,Other,FAQ,02-07-2024,1000,1100,1050,303,2024,7,2,Tuesday,3,100,
Gujarat,Surat,Mahuva,Parval,Other,FAQ,04-07-2024,1100,1200,1150,303,2024,7,4,Thursday,3,100,
Gujarat,Surat,Mahuva,Parval,Other,FAQ,18-07-2024,1500,1600,1550,303,2024,7,18,Thursday,3,100,
Gujarat,Surat,Mahuva,Parval,Other,FAQ,23-07-2024,1600,1750,1700,303,2024,7,23,Tuesday,3,150,
Gujarat,Surat,Mahuva,Bhindi,Other,FAQ,03-12-2024,4900,5100,5000,85,2024,12,3,Tuesday,4,200,
Gujarat,Surat,Mahuva,Bhindi,Other,FAQ,06-12-2024,4400,4600,4500,85,2024,12,6,Friday,4,200,
Gujarat,Surat,Mahuva,Parval,Other,FAQ,05-12-2024,3400,3600,3500,303,2024,12,5,Thursday,4,200,
Gujarat,Surat,Mahuva,Parval,Other,FAQ,07-12-2024,3400,3600,3500,303,2024,12,7,Saturday,4,200,
Gujarat,Surat,Mahuva,Parval,Other,FAQ,15-12-2024,4300,4550,4500,303,2024,12,15,Sunday,4,250,
Gujarat,Surat,Mahuva,Parval,Other,FAQ,16-12-2024,4400,4600,4500,303,2024,12,16,Monday,4,200,
Gujarat,Surat,Mahuva,Parval,Other,FAQ,30-12-2024,4500,4700,4600,303,2024,12,30,Monday,4,200,
Gujarat,Surat,Mahuva,Bhindi,Other,FAQ,05-11-2024,3400,3600,3500,85,2024,11,5,Tuesday,4,200,
Gujarat,Surat,Mahuva,Parval,Other,FAQ,04-11-2024,3900,4150,4100,303,2024,11,4,Monday,4,250,
Gujarat,Surat,Mahuva,Parval,Other,FAQ,05-11-2024,3400,3600,3500,303,2024,11,5,Tuesday,4,200,
Gujarat,Surat,Mahuva,Parval,Other,FAQ,06-11-2024,3900,4100,4000,303,2024,11,6,Wednesday,4,200,
Gujarat,Surat,Mahuva,Parval,Other,FAQ,11-11-2024,2800,3000,2900,303,2024,11,11,Monday,4,200,
Gujarat,Surat,Mahuva,Parval,Other,FAQ,13-11-2024,2900,3100,3000,303,2024,11,13,Wednesday,4,200,
Gujarat,Surat,Mahuva,Parval,Other,FAQ,19-11-2024,3000,3200,3100,303,2024,11,19,Tuesday,4,200,
Gujarat,Surat,Mahuva,Parval,Other,FAQ,28-11-2024,2500,2650,2600,303,2024,11,28,Thursday,4,150,
Gujarat,Surat,Mahuva,Bhindi,Other,FAQ,02-09-2024,2400,2600,2500,85,2024,9,2,Monday,3,200,
Gujarat,Surat,Mahuva,Bhindi,Other,FAQ,04-09-2024,2900,3100,3000,85,2024,9,4,Wednesday,3,200,
Gujarat,Surat,Mahuva,Bhindi,Other,FAQ,10-09-2024,2400,2600,2500,85,2024,9,10,Tuesday,3,200,
Gujarat,Surat,Mahuva,Bhindi,Other,FAQ,27-09-2024,2000,2000,2000,85,2024,9,27,Friday,3,0,
Gujarat,Surat,Mahuva,Parval,Other,FAQ,05-09-2024,3400,3550,3500,303,2024,9,5,Thursday,3,150,
Gujarat,Surat,Mahuva,Parval,Other,FAQ,09-09-2024,3900,4100,4000,303,2024,9,9,Monday,3,200,
Gujarat,Surat,Mahuva,Parval,Other,FAQ,25-09-2024,2300,2500,2400,303,2024,9,25,Wednesday,3,200,
Gujarat,Surat,Mahuva,Parval,Other,FAQ,26-09-2024,2500,2500,2500,303,2024,9,26,Thursday,3,0,
Gujarat,Surat,Mahuva,Bhindi,Other,FAQ,05-08-2024,3200,3400,3300,85,2024,8,5,Monday,3,200,
Gujarat,Surat,Mahuva,Parval,Other,FAQ,01-08-2024,1900,2000,1950,303,2024,8,1,Thursday,3,100,
Gujarat,Surat,Mahuva,Parval,Other,FAQ,21-08-2024,3400,3600,3550,303,2024,8,21,Wednesday,3,200,
Gujarat,Surat,Mahuva,Parval,Other,FAQ,22-08-2024,2400,2600,2550,303,2024,8,22,Thursday,3,200,
Gujarat,Surat,Mahuva,Parval,Other,FAQ,24-08-2024,2900,3100,3000,303,2024,8,24,Saturday,3,200,
Gujarat,Surat,Mahuva,Parval,Other,FAQ,29-08-2024,2900,3100,3000,303,2024,8,29,Thursday,3,200,
Gujarat,Surat,Mahuva,Bhindi,Other,FAQ,22-01-2024,2800,2900,2850,85,2024,1,22,Monday,1,100,
Gujarat,Surat,Mahuva,Bhindi,Other,FAQ,02-02-2024,2800,2900,2850,85,2024,2,2,Friday,1,100,
Gujarat,Surat,Mahuva,Bhindi,Other,FAQ,19-01-2024,3200,3300,3250,85,2024,1,19,Friday,1,100,
Gujarat,Surat,Mahuva,Bhindi,Other,FAQ,16-02-2024,2800,2900,2870,85,2024,2,16,Friday,1,100,
Gujarat,Surat,Mahuva,Bhindi,Other,FAQ,01-03-2024,2300,2400,2370,85,2024,3,1,Friday,1,100,
Gujarat,Surat,Mahuva,Bhindi,Other,FAQ,12-03-2024,2000,2100,2070,85,2024,3,12,Tuesday,1,100,
Gujarat,Surat,Mahuva,Bhindi,Other,FAQ,13-03-2024,1800,1900,1850,85,2024,3,13,Wednesday,1,100,
Gujarat,Surat,Mahuva,Bhindi,Other,FAQ,04-03-2024,1800,1900,1850,85,2024,3,4,Monday,1,100,
Gujarat,Surat,Mahuva,Bhindi,Other,FAQ,14-03-2024,2800,2900,2850,85,2024,3,14,Thursday,1,100,
Gujarat,Surat,Mahuva,Bhindi,Other,FAQ,30-03-2024,1800,1900,1870,85,2024,3,30,Saturday,1,100,
Gujarat,Surat,Mahuva,Bhindi,Other,FAQ,10-04-2024,1800,1900,1850,85,2024,4,10,Wednesday,2,100,
Gujarat,Surat,Mahuva,Bhindi,Other,FAQ,29-04-2024,1800,1900,1850,85,2024,4,29,Monday,2,100,
Gujarat,Surat,Mahuva,Bhindi,Other,FAQ,12-01-2024,2300,2400,2370,85,2024,1,12,Friday,1,100,
Gujarat,Surat,Mahuva,Bhindi,Other,FAQ,31-01-2024,3300,3400,3350,85,2024,1,31,Wednesday,1,100,
Gujarat,Surat,Mahuva,Bhindi,Other,FAQ,21-02-2024,1800,1900,1850,85,2024,2,21,Wednesday,1,100,
Gujarat,Surat,Mahuva,Bhindi,Other,FAQ,23-02-2024,2800,2900,2850,85,2024,2,23,Friday,1,100,
Gujarat,Surat,Mahuva,Bhindi,Other,FAQ,09-03-2024,2300,2400,2370,85,2024,3,9,Saturday,1,100,
Gujarat,Surat,Mahuva,Bhindi,Other,FAQ,18-03-2024,2000,2100,2050,85,2024,3,18,Monday,1,100,
Gujarat,Surat,Mahuva,Bhindi,Other,FAQ,28-03-2024,1800,1900,1850,85,2024,3,28,Thursday,1,100,
Gujarat,Surat,Mahuva,Bhindi,Other,FAQ,05-04-2024,1500,1600,1550,85,2024,4,5,Friday,2,100,
Gujarat,Surat,Mahuva,Parval,Other,FAQ,03-12-2024,3400,3600,3500,303,2024,12,3,Tuesday,4,200,
Gujarat,Surat,Mahuva,Parval,Other,FAQ,10-12-2024,2900,3100,3000,303,2024,12,10,Tuesday,4,200,
Gujarat,Surat,Mahuva,Parval,Other,FAQ,20-12-2024,4900,5100,5000,303,2024,12,20,Friday,4,200,
Gujarat,Surat,Mahuva,Bhindi,Other,FAQ,11-12-2024,2900,3100,3000,85,2024,12,11,Wednesday,4,200,
Gujarat,Surat,Mahuva,Bhindi,Other,FAQ,19-12-2024,6500,6700,6600,85,2024,12,19,Thursday,4,200,
Gujarat,Surat,Mahuva,Bhindi,Other,FAQ,27-12-2024,4500,4750,4600,85,2024,12,27,Friday,4,250,
Gujarat,Surat,Mahuva,Bhindi,Other,FAQ,28-12-2024,3500,3700,3600,85,2024,12,28,Saturday,4,200,
Gujarat,Surat,Mahuva,Mango,Totapuri,Medium,23-05-2024,1750,2250,2000,20,2024,5,23,Thursday,2,500,
Gujarat,Surat,Mahuva,Mango,Raspuri,Medium,30-05-2024,2250,2750,2500,20,2024,5,30,Thursday,2,500,
Gujarat,Surat,Mahuva,Mango,Keshar,Medium,10-06-2024,4000,5500,5000,20,2024,6,10,Monday,2,1500,
Gujarat,Surat,Mahuva,Mango,Keshar,Medium,13-06-2024,4500,6000,5500,20,2024,6,13,Thursday,2,1500,
Gujarat,Surat,Mahuva,Mango,Keshar,Medium,24-06-2024,9000,10000,9500,20,2024,6,24,Monday,2,1000,
Gujarat,Surat,Mahuva,Mango,Keshar,Medium,29-06-2024,9000,10000,9500,20,2024,6,29,Saturday,2,1000,
Gujarat,Surat,Mahuva,Mango,Other,Medium,06-06-2024,1000,1500,1250,20,2024,6,6,Thursday,2,500,
Gujarat,Surat,Mahuva,Mango,Other,Medium,08-06-2024,1500,2000,1750,20,2024,6,8,Saturday,2,500,
Gujarat,Surat,Mahuva,Mango,Other,Medium,20-06-2024,2500,3000,2750,20,2024,6,20,Thursday,2,500,
Gujarat,Surat,Mahuva,Mango,Other,Medium,22-06-2024,2500,3000,2750,20,2024,6,22,Saturday,2,500,
Gujarat,Surat,Mahuva,Mango,Raspuri,Medium,03-06-2024,2000,2500,2250,20,2024,6,3,Monday,2,500,
Gujarat,Surat,Mahuva,Mango,Raspuri,Medium,05-06-2024,2000,2500,2250,20,2024,6,5,Wednesday,2,500,
Gujarat,Surat,Mahuva,Mango,Raspuri,Medium,10-06-2024,2500,3000,2750,20,2024,6,10,Monday,2,500,
Gujarat,Surat,Mahuva,Mango,Raspuri,Medium,21-06-2024,4000,5000,4500,20,2024,6,21,Friday,2,1000,
Gujarat,Surat,Mahuva,Mango,Raspuri,Medium,24-06-2024,4500,5000,4750,20,2024,6,24,Monday,2,500,
Gujarat,Surat,Mahuva,Mango,Raspuri,Medium,25-06-2024,4000,4500,4250,20,2024,6,25,Tuesday,2,500,
Gujarat,Surat,Mahuva,Mango,Raspuri,Medium,26-06-2024,4000,4500,4250,20,2024,6,26,Wednesday,2,500,
Gujarat,Surat,Mahuva,Mango,Totapuri,Medium,07-06-2024,2500,2500,2500,20,2024,6,7,Friday,2,0,
Gujarat,Surat,Mahuva,Mango,Totapuri,Medium,08-06-2024,2500,2500,2500,20,2024,6,8,Saturday,2,0,
Gujarat,Surat,Mahuva,Mango,Totapuri,Medium,10-06-2024,2000,2000,2000,20,2024,6,10,Monday,2,0,
Gujarat,Surat,Mahuva,Mango,Totapuri,Medium,19-06-2024,3500,3500,3500,20,2024,6,19,Wednesday,2,0,
Gujarat,Surat,Mahuva,Mango,Totapuri,Medium,27-06-2024,3000,3000,3000,20,2024,6,27,Thursday,2,0,
Gujarat,Surat,Mahuva,Bhindi,Other,FAQ,04-07-2024,3300,3400,3350,85,2024,7,4,Thursday,3,100,
Gujarat,Surat,Mahuva,Bhindi,Other,FAQ,06-07-2024,3800,3900,3870,85,2024,7,6,Saturday,3,100,
Gujarat,Surat,Mahuva,Bhindi,Other,FAQ,10-07-2024,4000,4100,4050,85,2024,7,10,Wednesday,3,100,
Gujarat,Surat,Mahuva,Bhindi,Other,FAQ,11-07-2024,4700,4800,4750,85,2024,7,11,Thursday,3,100,
Gujarat,Surat,Mahuva,Bhindi,Other,FAQ,20-07-2024,1400,1550,1500,85,2024,7,20,Saturday,3,150,
Gujarat,Surat,Mahuva,Mango,Keshar,Medium,01-07-2024,9000,9500,9250,20,2024,7,1,Monday,3,500,
Gujarat,Surat,Mahuva,Mango,Other,Medium,01-07-2024,2500,3000,2750,20,2024,7,1,Monday,3,500,
Gujarat,Surat,Mahuva,Mango,Other,Medium,06-07-2024,2000,2500,2250,20,2024,7,6,Saturday,3,500,
Gujarat,Surat,Mahuva,Mango,Other,Medium,09-07-2024,1250,2000,1750,20,2024,7,9,Tuesday,3,750,
Gujarat,Surat,Mahuva,Mango,Raspuri,Medium,01-07-2024,3500,4500,4000,20,2024,7,1,Monday,3,1000,
Gujarat,Surat,Mahuva,Mango,Raspuri,Medium,04-07-2024,3000,3500,3250,20,2024,7,4,Thursday,3,500,
Gujarat,Surat,Mahuva,Mango,Raspuri,Small,06-07-2024,2500,3000,2750,20,2024,7,6,Saturday,3,500,
Gujarat,Surat,Mahuva,Parval,Other,FAQ,01-01-2024,4200,4300,4270,303,2024,1,1,Monday,1,100,
Gujarat,Surat,Mahuva,Parval,Other,FAQ,06-01-2024,4500,4600,4550,303,2024,1,6,Saturday,1,100,
Gujarat,Surat,Mahuva,Parval,Other,FAQ,08-01-2024,4000,4100,4070,303,2024,1,8,Monday,1,100,
Gujarat,Surat,Mahuva,Parval,Other,FAQ,09-01-2024,4000,4100,4050,303,2024,1,9,Tuesday,1,100,
Gujarat,Surat,Mahuva,Parval,Other,FAQ,10-01-2024,3500,3600,3570,303,2024,1,10,Wednesday,1,100,
Gujarat,Surat,Mahuva,Parval,Other,FAQ,12-01-2024,4000,4100,4070,303,2024,1,12,Friday,1,100,
Gujarat,Surat,Mahuva,Parval,Other,FAQ,15-01-2024,3800,3900,3850,303,2024,1,15,Monday,1,100,
Gujarat,Surat,Mahuva,Parval,Other,FAQ,20-01-2024,5200,5300,5270,303,2024,1,20,Saturday,1,100,
Gujarat,Surat,Mahuva,Parval,Other,FAQ,26-01-2024,5800,5900,5850,303,2024,1,26,Friday,1,100,
Gujarat,Surat,Mahuva,Parval,Other,FAQ,12-02-2024,5800,5900,5870,303,2024,2,12,Monday,1,100,
Gujarat,Surat,Mahuva,Parval,Other,FAQ,23-02-2024,4800,4900,4850,303,2024,2,23,Friday,1,100,
Gujarat,Surat,Mahuva,Parval,Other,FAQ,26-02-2024,5300,5400,5350,303,2024,2,26,Monday,1,100,
Gujarat,Surat,Mahuva,Parval,Other,FAQ,27-02-2024,5300,5400,5370,303,2024,2,27,Tuesday,1,100,
Gujarat,Surat,Mahuva,Parval,Other,FAQ,11-03-2024,4500,4600,4550,303,2024,3,11,Monday,1,100,
Gujarat,Surat,Mahuva,Parval,Other,FAQ,21-03-2024,4000,4100,4050,303,2024,3,21,Thursday,1,100,
Gujarat,Surat,Mahuva,Parval,Other,FAQ,28-03-2024,3800,3900,3850,303,2024,3,28,Thursday,1,100,
Gujarat,Surat,Mahuva,Parval,Other,FAQ,01-04-2024,2500,2600,2550,303,2024,4,1,Monday,2,100,
Gujarat,Surat,Mahuva,Parval,Other,FAQ,05-04-2024,2600,2700,2650,303,2024,4,5,Friday,2,100,
Gujarat,Surat,Mahuva,Parval,Other,FAQ,18-04-2024,3400,3500,3470,303,2024,4,18,Thursday,2,100,
Gujarat,Surat,Mahuva,Parval,Other,FAQ,26-04-2024,2800,2900,2850,303,2024,4,26,Friday,2,100,
Gujarat,Surat,Mahuva,Parval,Other,FAQ,29-04-2024,3300,3400,3350,303,2024,4,29,Monday,2,100,
Gujarat,Surat,Mahuva,Bhindi,Other,FAQ,08-01-2024,2500,2600,2570,85,2024,1,8,Monday,1,100,
Gujarat,Surat,Mahuva,Bhindi,Other,FAQ,25-01-2024,3000,3100,3070,85,2024,1,25,Thursday,1,100,
Gujarat,Surat,Mahuva,Bhindi,Other,FAQ,03-02-2024,2300,2400,2370,85,2024,2,3,Saturday,1,100,
Gujarat,Surat,Mahuva,Bhindi,Other,FAQ,05-02-2024,3000,3100,3050,85,2024,2,5,Monday,1,100,
Gujarat,Surat,Mahuva,Bhindi,Other,FAQ,19-02-2024,2300,2400,2350,85,2024,2,19,Monday,1,100,
Gujarat,Surat,Mahuva,Bhindi,Other,FAQ,20-02-2024,1800,1900,1870,85,2024,2,20,Tuesday,1,100,
Gujarat,Surat,Mahuva,Bhindi,Other,FAQ,21-03-2024,2300,2400,2350,85,2024,3,21,Thursday,1,100,
Gujarat,Surat,Mahuva,Bhindi,Other,FAQ,26-03-2024,1800,1900,1850,85,2024,3,26,Tuesday,1,100,
Gujarat,Surat,Mahuva,Bhindi,Other,FAQ,02-04-2024,1300,1400,1370,85,2024,4,2,Tuesday,2,100,
Gujarat,Surat,Mahuva,Bhindi,Other,FAQ,20-04-2024,2300,2400,2350,85,2024,4,20,Saturday,2,100,
Gujarat,Surat,Mahuva,Bhindi,Other,FAQ,26-04-2024,1300,1400,1350,85,2024,4,26,Friday,2,100,
Gujarat,Surat,Mahuva,Bhindi,Other,FAQ,30-04-2024,1300,1400,1350,85,2024,4,30,Tuesday,2,100,
Gujarat,Surat,Mahuva,Bhindi,Other,FAQ,03-09-2024,2400,2600,2500,85,2024,9,3,Tuesday,3,200,
Gujarat,Surat,Mahuva,Bhindi,Other,FAQ,06-09-2024,3900,4100,4000,85,2024,9,6,Friday,3,200,
Gujarat,Surat,Mahuva,Bhindi,Other,FAQ,11-09-2024,2800,3000,2900,85,2024,9,11,Wednesday,3,200,
Gujarat,Surat,Mahuva,Bhindi,Other,FAQ,18-09-2024,4400,4600,4500,85,2024,9,18,Wednesday,3,200,
Gujarat,Surat,Mahuva,Bhindi,Other,FAQ,09-10-2024,3400,3600,3500,85,2024,10,9,Wednesday,4,200,
Gujarat,Surat,Mahuva,Parval,Other,FAQ,09-10-2024,4400,4550,4500,303,2024,10,9,Wednesday,4,150,
Gujarat,Surat,Mahuva,Parval,Other,FAQ,04-10-2024,3000,3150,3100,303,2024,10,4,Friday,4,150,
Gujarat,Surat,Mahuva,Parval,Other,FAQ,01-10-2024,3400,3600,3500,303,2024,10,1,Tuesday,4,200,
Gujarat,Surat,Mahuva,Parval,Other,FAQ,08-10-2024,3400,3600,3500,303,2024,10,8,Tuesday,4,200,
Gujarat,Surat,Mahuva,Parval,Other,FAQ,28-10-2024,4000,4150,4100,303,2024,10,28,Monday,4,150,
Gujarat,Surat,Mahuva,Parval,Other,FAQ,07-10-2024,3400,3600,3500,303,2024,10,7,Monday,4,200,
Gujarat,Surat,Mahuva,Parval,Other,FAQ,19-10-2024,3400,3600,3500,303,2024,10,19,Saturday,4,200,
Gujarat,Surat,Mahuva,Parval,Other,FAQ,08-11-2024,1900,2100,2000,303,2024,11,8,Friday,4,200,
Gujarat,Surat,Mahuva,Parval,Other,FAQ,09-11-2024,2400,2600,2500,303,2024,11,9,Saturday,4,200,
Gujarat,Surat,Mahuva,Parval,Other,FAQ,15-11-2024,2900,3100,3000,303,2024,11,15,Friday,4,200,
Gujarat,Surat,Mahuva,Parval,Other,FAQ,26-11-2024,2900,3100,3000,303,2024,11,26,Tuesday,4,200,
Gujarat,Surat,Mahuva,Parval,Other,FAQ,29-11-2024,2900,3100,3000,303,2024,11,29,Friday,4,200,
Gujarat,Surat,Mahuva,Bhindi,Other,FAQ,21-11-2024,1900,2100,2000,85,2024,11,21,Thursday,4,200,
Gujarat,Surat,Mahuva,Parval,Other,FAQ,08-05-2024,2800,2900,2850,303,2024,5,8,Wednesday,2,100,
Gujarat,Surat,Mahuva,Parval,Other,FAQ,09-05-2024,2800,2900,2870,303,2024,5,9,Thursday,2,100,
Gujarat,Surat,Mahuva,Parval,Other,FAQ,11-05-2024,3000,3100,3050,303,2024,5,11,Saturday,2,100,
Gujarat,Surat,Mahuva,Parval,Other,FAQ,15-05-2024,2000,2100,2070,303,2024,5,15,Wednesday,2,100,
Gujarat,Surat,Mahuva,Parval,Other,FAQ,16-05-2024,1300,1400,1350,303,2024,5,16,Thursday,2,100,
Gujarat,Surat,Mahuva,Parval,Other,FAQ,17-05-2024,1200,1300,1270,303,2024,5,17,Friday,2,100,
Gujarat,Surat,Mahuva,Parval,Other,FAQ,25-05-2024,3300,3400,3370,303,2024,5,25,Saturday,2,100,
Gujarat,Surat,Mahuva,Parval,Other,FAQ,27-05-2024,3500,3600,3550,303,2024,5,27,Monday,2,100,
Gujarat,Surat,Mahuva,Parval,Other,FAQ,29-05-2024,2800,2900,2870,303,2024,5,29,Wednesday,2,100,
Gujarat,Surat,Mahuva,Bhindi,Other,FAQ,04-06-2024,2800,2900,2870,85,2024,6,4,Tuesday,2,100,
Gujarat,Surat,Mahuva,Bhindi,Other,FAQ,11-06-2024,3300,3400,3370,85,2024,6,11,Tuesday,2,100,
Gujarat,Surat,Mahuva,Bhindi,Other,FAQ,12-06-2024,3300,3400,3350,85,2024,6,12,Wednesday,2,100,
Gujarat,Surat,Mahuva,Bhindi,Other,FAQ,14-06-2024,3500,3600,3550,85,2024,6,14,Friday,2,100,
Gujarat,Surat,Mahuva,Bhindi,Other,FAQ,27-06-2024,4000,4100,4070,85,2024,6,27,Thursday,2,100,
Gujarat,Surat,Mahuva,Parval,Other,FAQ,12-06-2024,3000,3100,3050,303,2024,6,12,Wednesday,2,100,
Gujarat,Surat,Mahuva,Parval,Other,FAQ,15-06-2024,2800,2900,2850,303,2024,6,15,Saturday,2,100,
Gujarat,Surat,Mahuva,Bhindi,Other,FAQ,01-05-2024,1000,1100,1070,85,2024,5,1,Wednesday,2,100,
Gujarat,Surat,Mahuva,Bhindi,Other,FAQ,10-05-2024,1000,1100,1050,85,2024,5,10,Friday,2,100,
Gujarat,Surat,Mahuva,Bhindi,Other,FAQ,13-05-2024,800,900,850,85,2024,5,13,Monday,2,100,
Gujarat,Surat,Mahuva,Bhindi,Other,FAQ,20-05-2024,1300,1400,1350,85,2024,5,20,Monday,2,100,
Gujarat,Surat,Mahuva,Parval,Other,FAQ,03-07-2024,1200,1300,1270,303,2024,7,3,Wednesday,3,100,
Gujarat,Surat,Mahuva,Parval,Other,FAQ,11-07-2024,1500,1600,1550,303,2024,7,11,Thursday,3,100,
Gujarat,Surat,Mahuva,Parval,Other,FAQ,25-07-2024,1400,1570,1500,303,2024,7,25,Thursday,3,170,
Gujarat,Surat,Mahuva,Parval,Other,FAQ,30-07-2024,2000,2150,2100,303,2024,7,30,Tuesday,3,150,
Gujarat,Surat,Mahuva,Parval,Other,FAQ,02-08-2024,1900,2000,1950,303,2024,8,2,Friday,3,100,
Gujarat,Surat,Mahuva,Parval,Other,FAQ,06-08-2024,2300,2500,2450,303,2024,8,6,Tuesday,3,200,
Gujarat,Surat,Mahuva,Parval,Other,FAQ,12-08-2024,3400,3550,3500,303,2024,8,12,Monday,3,150,
Gujarat,Surat,Mahuva,Parval,Other,FAQ,14-08-2024,3800,4000,3950,303,2024,8,14,Wednesday,3,200,
Gujarat,Surat,Mahuva,Parval,Other,FAQ,06-09-2024,3400,3600,3500,303,2024,9,6,Friday,3,200,
Gujarat,Surat,Mahuva,Parval,Other,FAQ,11-09-2024,4400,4600,4500,303,2024,9,11,Wednesday,3,200,
Gujarat,Surat,Mahuva,Parval,Other,FAQ,20-09-2024,4100,4250,4200,303,2024,9,20,Friday,3,150,
Gujarat,Surat,Mahuva,Bhindi,Other,FAQ,13-08-2024,2500,2500,2500,85,2024,8,13,Tuesday,3,0,
Gujarat,Surat,Mahuva,Bhindi,Other,FAQ,14-08-2024,1800,2000,1900,85,2024,8,14,Wednesday,3,200,
Gujarat,Surat,Mahuva,Bhindi,Other,FAQ,30-08-2024,1500,1500,1500,85,2024,8,30,Friday,3,0,
Gujarat,Surat,Mahuva,Bhindi,Other,FAQ,31-08-2024,1400,1550,1500,85,2024,8,31,Saturday,3,150,
Gujarat,Surat,Mahuva,Parval,Other,FAQ,18-01-2024,4800,4900,4870,303,2024,1,18,Thursday,1,100,
Gujarat,Surat,Mahuva,Parval,Other,FAQ,24-01-2024,5500,5600,5550,303,2024,1,24,Wednesday,1,100,
Gujarat,Surat,Mahuva,Parval,Other,FAQ,01-02-2024,6200,6300,6270,303,2024,2,1,Thursday,1,100,
Gujarat,Surat,Mahuva,Parval,Other,FAQ,03-02-2024,6800,6900,6870,303,2024,2,3,Saturday,1,100,
Gujarat,Surat,Mahuva,Parval,Other,FAQ,07-02-2024,7800,7900,7850,303,2024,2,7,Wednesday,1,100,
Gujarat,Surat,Mahuva,Parval,Other,FAQ,15-02-2024,7300,7400,7350,303,2024,2,15,Thursday,1,100,
Gujarat,Surat,Mahuva,Parval,Other,FAQ,24-02-2024,4800,4900,4870,303,2024,2,24,Saturday,1,100,
Gujarat,Surat,Mahuva,Parval,Other,FAQ,13-03-2024,4500,4600,4550,303,2024,3,13,Wednesday,1,100,
Gujarat,Surat,Mahuva,Parval,Other,FAQ,18-03-2024,4800,4900,4850,303,2024,3,18,Monday,1,100,
Gujarat,Surat,Mahuva,Parval,Other,FAQ,22-03-2024,3300,3400,3350,303,2024,3,22,Friday,1,100,
Gujarat,Surat,Mahuva,Parval,Other,FAQ,23-03-2024,3300,3400,3370,303,2024,3,23,Saturday,1,100,
Gujarat,Surat,Mahuva,Parval,Other,FAQ,03-04-2024,2500,2600,2550,303,2024,4,3,Wednesday,2,100,
Gujarat,Surat,Mahuva,Parval,Other,FAQ,10-04-2024,2800,2900,2850,303,2024,4,10,Wednesday,2,100,
Gujarat,Surat,Mahuva,Parval,Other,FAQ,12-04-2024,3000,3100,3050,303,2024,4,12,Friday,2,100,
Gujarat,Surat,Mahuva,Parval,Other,FAQ,15-04-2024,2900,3000,2970,303,2024,4,15,Monday,2,100,
Gujarat,Surat,Mahuva,Parval,Other,FAQ,25-04-2024,3000,3100,3050,303,2024,4,25,Thursday,2,100,
Gujarat,Surat,Mahuva,Parval,Other,FAQ,27-04-2024,3000,3100,3070,303,2024,4,27,Saturday,2,100,
Gujarat,Surat,Mahuva,Parval,Other,FAQ,30-04-2024,3000,3100,3050,303,2024,4,30,Tuesday,2,100,
Gujarat,Surat,Mahuva,Bhindi,Other,FAQ,09-04-2024,1900,2000,1970,85,2024,4,9,Tuesday,2,100,
Gujarat,Surat,Mahuva,Bhindi,Other,FAQ,04-01-2024,2500,2600,2570,85,2024,1,4,Thursday,1,100,
Gujarat,Surat,Mahuva,Bhindi,Other,FAQ,05-01-2024,2800,2900,2850,85,2024,1,5,Friday,1,100,
Gujarat,Surat,Mahuva,Bhindi,Other,FAQ,09-01-2024,2500,2600,2550,85,2024,1,9,Tuesday,1,100,
Gujarat,Surat,Mahuva,Bhindi,Other,FAQ,10-01-2024,2300,2400,2370,85,2024,1,10,Wednesday,1,100,
Gujarat,Surat,Mahuva,Bhindi,Other,FAQ,15-01-2024,1200,1300,1250,85,2024,1,15,Monday,1,100,
Gujarat,Surat,Mahuva,Bhindi,Other,FAQ,20-01-2024,3200,3300,3270,85,2024,1,20,Saturday,1,100,
Gujarat,Surat,Mahuva,Bhindi,Other,FAQ,26-01-2024,3300,3400,3350,85,2024,1,26,Friday,1,100,
Gujarat,Surat,Mahuva,Bhindi,Other,FAQ,27-01-2024,3300,3400,3370,85,2024,1,27,Saturday,1,100,
Gujarat,Surat,Mahuva,Bhindi,Other,FAQ,08-02-2024,2800,2900,2850,85,2024,2,8,Thursday,1,100,
Gujarat,Surat,Mahuva,Bhindi,Other,FAQ,13-02-2024,2300,2400,2350,85,2024,2,13,Tuesday,1,100,
Gujarat,Surat,Mahuva,Bhindi,Other,FAQ,14-02-2024,2800,2900,2870,85,2024,2,14,Wednesday,1,100,
Gujarat,Surat,Mahuva,Bhindi,Other,FAQ,24-02-2024,2500,2600,2570,85,2024,2,24,Saturday,1,100,
Gujarat,Surat,Mahuva,Bhindi,Other,FAQ,02-03-2024,2000,2100,2050,85,2024,3,2,Saturday,1,100,
Gujarat,Surat,Mahuva,Bhindi,Other,FAQ,11-03-2024,2800,2900,2850,85,2024,3,11,Monday,1,100,
Gujarat,Surat,Mahuva,Bhindi,Other,FAQ,16-03-2024,2300,2400,2350,85,2024,3,16,Saturday,1,100,
Gujarat,Surat,Mahuva,Bhindi,Other,FAQ,19-03-2024,2300,2400,2370,85,2024,3,19,Tuesday,1,100,
Gujarat,Surat,Mahuva,Bhindi,Other,FAQ,04-04-2024,1500,1600,1570,85,2024,4,4,Thursday,2,100,
Gujarat,Surat,Mahuva,Bhindi,Other,FAQ,17-04-2024,1800,1900,1850,85,2024,4,17,Wednesday,2,100,
Gujarat,Surat,Mahuva,Parval,Other,FAQ,05-06-2024,3300,3400,3350,303,2024,6,5,Wednesday,2,100,
Gujarat,Surat,Mahuva,Parval,Other,FAQ,10-06-2024,2800,2900,2850,303,2024,6,10,Monday,2,100,
Gujarat,Surat,Mahuva,Parval,Other,FAQ,19-06-2024,3000,3100,3050,303,2024,6,19,Wednesday,2,100,
Gujarat,Surat,Mahuva,Parval,Other,FAQ,21-06-2024,2800,2900,2870,303,2024,6,21,Friday,2,100,
Gujarat,Surat,Mahuva,Parval,Other,FAQ,22-06-2024,3800,3900,3850,303,2024,6,22,Saturday,2,100,
Gujarat,Surat,Mahuva,Parval,Other,FAQ,25-06-2024,3800,3900,3870,303,2024,6,25,Tuesday,2,100,
Gujarat,Surat,Mahuva,Parval,Other,FAQ,26-06-2024,3500,3600,3550,303,2024,6,26,Wednesday,2,100,
